Client id,Transaction id,Date,Time,Booking start date time,Booking end date time,First name,Last name,Full name,Company name,Exclude customer notifications,Email,Apt,Address,City,State,Zip/Postal code,Phone,Rating value,Rating comment,Service total (USD),Sales tax,Discounted total,Final amount (USD),Amount paid by customer (USD),Refunded amount (USD),Amount owed by customer (USD),Tip (USD),Parking (USD),Bonus (USD),Reschedule fee (USD),Payment method,Card last 4 digits,Frequency,Occurrence,Discount code,Discount from code (USD),Discount amount (USD),Discount from frequency (USD),Discount from referral (USD),Giftcard amount used (USD),Provider details,Provider/team,Provider/team (without ids),Provider/team payment (USD),Provider payment (summary) (USD),Provider/team has keys,Created on,Created by,Estimated job length (HH:MM),Industry,Form,Location,Location id,Location type,Service,Booking note,Private customer note,Provider note,Key note,Special notes,Booking id,Customer id,Price adjustment,Price adjustment comment,Booking status,Extras,Excludes,Expedited amount,Service fee,Cancelled date,Cancellation reason,Cancellation fee,Provider cancellation fee,Bedrooms,Bathrooms,Sq Ft,House Sq Ft,Floors
,,01/04/2025,09:00 AM,2025-01-04T09:00:00-08:00,2025-01-04T13:00:00-08:00,Mary,Noble-Tolla,Mary Noble-Tolla,,true,maryagnesnoble@gmail.com,,"6985 Hillstone Ct, Livermore, CA, 94551",Livermore,California,="",6507989900,0,,295.00,0.00,221.25,175.00,0.00,0.00,175.00,0.00,0.00,0.00,0.00,CC,7153,Weekly,recurring,,0.00,0.00,73.75,0.00,0,"[
  {
    Email Id: ashleypetite13@hotmail.com,
    Id: 82,
    Name: Kristian Petite,
    Payment Amount: 0.00,
    Phone Number: 2093071575
  }
]",82: Kristian Petite,Kristian Petite,0.00,,,2024-12-11,Prateek Gupta,04:00,Home Cleaning,Form 1,Test Location,0,Service Area,Regular Cleaning,,"1. Fold clean laundry (1-3 baskets of it)NOTE: For the laundry, could they use BOTH Ecos Laundry Detergent liquid (put in the drawer) and Oxy powder (put this inside the machine with the clothes)? Both detergents are in the cupboard above the washing machine or on top of the machine. Just a small amount of Oxy. 2. Load / unload dishwasher and put away dishes and silverware 3. Wash any pots/pans that dont go in dishwasher 4. Check all the trash cans and see if the trash or recycling need taking out? Replace old liners with new trash bags (if provided) 5. Generally pick up 6. Wash sofa covers (they can be removed and washed in washing machine then air dried)Thank you! &lt;3","1. Fold clean laundry (1-3 baskets of it)NOTE: For the laundry, could they use BOTH Ecos Laundry Detergent liquid (put in the drawer) and Oxy powder (put this inside the machine with the clothes)? Both detergents are in the cupboard above the washing machine or on top of the machine. Just a small amount of Oxy. 2. Load / unload dishwasher and put away dishes and silverware 3. Wash any pots/pans that dont go in dishwasher 4. Check all the trash cans and see if the trash or recycling need taking out? Replace old liners with new trash bags (if provided) 5. Generally pick up 6. Wash sofa covers (they can be removed and washed in washing machine then air dried)Thank you! &lt;3","1. Fold clean laundry (1-3 baskets of it)NOTE: For the laundry, could they use BOTH Ecos Laundry Detergent liquid (put in the drawer) and Oxy powder (put this inside the machine with the clothes)? Both detergents are in the cupboard above the washing machine or on top of the machine. Just a small amount of Oxy. 2. Load / unload dishwasher and put away dishes and silverware 3. Wash any pots/pans that dont go in dishwasher 4. Check all the trash cans and see if the trash or recycling need taking out? Replace old liners with new trash bags (if provided) 5. Generally pick up 6. Wash sofa covers (they can be removed and washed in washing machine then air dried)Thank you! &lt;3","1. Fold clean laundry (1-3 baskets of it)NOTE: For the laundry, could they use BOTH Ecos Laundry Detergent liquid (put in the drawer) and Oxy powder (put this inside the machine with the clothes)? Both detergents are in the cupboard above the washing machine or on top of the machine. Just a small amount of Oxy. 2. Load / unload dishwasher and put away dishes and silverware 3. Wash any pots/pans that dont go in dishwasher 4. Check all the trash cans and see if the trash or recycling need taking out? Replace old liners with new trash bags (if provided) 5. Generally pick up 6. Wash sofa covers (they can be removed and washed in washing machine then air dried)Thank you! &lt;3",589,73,175.00,,Cancelled,Laundry & Folding,Bedroom,0.00,0.00,2025-01-02,[],0.00,0.00,4,3,1 - 999 Sq Ft,,
,,01/08/2025,10:00 AM,2025-01-08T10:00:00-08:00,2025-01-08T15:15:00-08:00,Priya,Joshi,Priya Joshi,,true,priyamkj@gmail.com,,"4050 Kinsale St, Dublin, CA, USA",Dublin,California,="94568",6506609520,0,,306.67,0.00,276.00,276.00,0.00,0.00,276.00,0.00,0.00,0.00,0.00,CC,9544,Monthly Home Cleaning Service,recurring,,0.00,0.00,30.67,0.00,0,"[
  {
    Id: 75,
    Name: Nelson \u0026 Ingrid - Tri-Valley
  },
  {
    Email Id: tamurcia11@gmail.com,
    Id: 76,
    Name: Tatiana Murcia - Livermore,
    Payment Amount: 0.00,
    Phone Number: 9256395409
  }
]",75: Nelson & Ingrid - Tri-Valley,Nelson & Ingrid - Tri-Valley,0.00,,,2024-12-10,Priya Joshi,05:15,Home Cleaning,Form 1,Test Location,0,Service Area,Regular Cleaning,,,,,,577,80,0.00,,Cancelled,,,0.00,0.00,2025-01-06,"[], Customer called to cancel ",0.00,0.00,4,3.5,2000 - 2499 Sq Ft,,
,,01/17/2025,02:00 PM,2025-01-17T14:00:00-08:00,2025-01-17T18:00:00-08:00,Jaya,Singhal,Jaya Singhal,,false,singhaljaya@gmail.com,,"2859 Feather Road, Manteca, CA, USA",Manteca,California,="95337",4088380687,0,,125.00,0.00,112.50,112.50,0.00,0.00,112.50,0.00,0.00,0.00,0.00,Cash/Check,,Monthly Home Cleaning Service,recurring,,0.00,0.00,12.50,0.00,0,,Unassigned,Unassigned,0.00,,,2024-10-22,Prateek Gupta,04:00,Home Cleaning,Form 1,Test Location,0,Service Area,Regular Cleaning,,,,,,504,9,0.00,,Cancelled,,Bedroom,0.00,0.00,2025-01-16,[],0.00,0.00,4,2.5,1500 - 1999 Sq Ft,,
,,01/21/2025,09:00 AM,2025-01-21T09:00:00-08:00,2025-01-21T13:00:00-08:00,Mary,Moo,Mary Moo,,false,eugeneit510@gmail.com,,"3359 Green Meadow Drive, Danville, CA, USA",Danville,California,="94506",4154399839,0,,360.00,0.00,324.00,324.00,0.00,0.00,324.00,0.00,0.00,0.00,0.00,Cash/Check,,Monthly Home Cleaning Service,recurring,,0.00,0.00,36.00,0.00,0,"[
  {
    Id: 75,
    Name: Nelson \u0026 Ingrid - Tri-Valley
  },
  {
    Email Id: tamurcia11@gmail.com,
    Id: 76,
    Name: Tatiana Murcia - Livermore,
    Payment Amount: 0.00,
    Phone Number: 9256395409
  }
]",75: Nelson & Ingrid - Tri-Valley,Nelson & Ingrid - Tri-Valley,0.00,,,2024-09-05,Prateek Gupta,04:00,Home Cleaning,Form 1,Test Location,0,Service Area,Regular Cleaning,"Area &mdash;&mdash;Cleaning Tasks BATHROOMS 1. Upstairs Main Bathroom &mdash;&mdash; Sink/Counter, Shower/Shower Glass and Tub (using *Microfiber towels*), Toilet, Dusting (i.e., windows, baseboards, window sills, window shutters) ⁃ NOTE: Main bathroom shower floor is a black tile with black-colored grout, please use the following cleaning solution for the shower floors only. Pls use non-abrasive shower floor Cleaning Solution (Ingredients): &bull; 1 cup of distilled white vinegar &bull; 1 cup of water &bull; Few drops of essential oil for fragrance (e.g., lemon, tea tree, or lavender)&hellip;I can provide this. 2. Upstairs 2nd Bath &mdash;&mdash;Sink/Counter, Shower/ Shower Glass (using *Microfiber towels*), Toilet, DustingNote: You can use bleach or standard cleaning products for upstairs 2nd bathroom that has shower with white tiles. Would like to that to remain white 3. Downstairs Bath &mdash;&mdash;Sink/Counter, Shower/Shower Glass and Tub, Toilet, Dusting BEDROOMS 1. Main Bedroom -&mdash;&mdash;Vacuum, Dusting (desk area, TV counter, fireplace mantel, window shutters/window sill)2. 2nd upstairs Bedroom -&mdash;&mdash;Vacuum, Dusting (bed frame/top of dresser/book shelf/window shutters/Window sill),3. 3rd upstairs Bedroom &mdash;&mdash; Vacuum, Dusting (bed frame/top of dresser/book shelf/window shutters/Window sill)4. Downstairs Bedroom -&mdash;&mdash;Vacuum, Dusting (bed frame/top of dresser/book shelf/window shutters/Window sill, TV) COMMUNAL AREAS 0. Family Room &mdash;&mdash;Vacuum (behind chair/under sofa), Dusting (book shelf/window shutters/window sill/ TV/ bookshelf, Mantle, top of Shoe Rack (dust), Behind shoe rack (vacuum), Under bench (vacuum) 1. Living Room &mdash;&mdash;Vacuum, Dusting (window shutters/Window sills/mantle/treadmill) 2. Dining Room -&mdash;&mdash;Vacuum (carpet), Dusting (window shutters/window sills) 3. Outside (front door/back door)&mdash;&mdash; remove Cobwebs around the door entrance/doorbell/door, etc. FLOOR AREAS All Hardwood Floors -&mdash;&mdash;Vacuum, wet mop All Carpet area -&mdash;&mdash;Vacuum All windows -&mdash;&mdash; dusting (shutters/window sill)","Area &mdash;&mdash;Cleaning Tasks BATHROOMS 1. Upstairs Main Bathroom &mdash;&mdash; Sink/Counter, Shower/Shower Glass and Tub (using *Microfiber towels*), Toilet, Dusting (i.e., windows, baseboards, window sills, window shutters) ⁃ NOTE: Main bathroom shower floor is a black tile with black-colored grout, please use the following cleaning solution for the shower floors only. Pls use non-abrasive shower floor Cleaning Solution (Ingredients): &bull; 1 cup of distilled white vinegar &bull; 1 cup of water &bull; Few drops of essential oil for fragrance (e.g., lemon, tea tree, or lavender)&hellip;I can provide this. 2. Upstairs 2nd Bath &mdash;&mdash;Sink/Counter, Shower/ Shower Glass (using *Microfiber towels*), Toilet, DustingNote: You can use bleach or standard cleaning products for upstairs 2nd bathroom that has shower with white tiles. Would like to that to remain white 3. Downstairs Bath &mdash;&mdash;Sink/Counter, Shower/Shower Glass and Tub, Toilet, Dusting BEDROOMS 1. Main Bedroom -&mdash;&mdash;Vacuum, Dusting (desk area, TV counter, fireplace mantel, window shutters/window sill)2. 2nd upstairs Bedroom -&mdash;&mdash;Vacuum, Dusting (bed frame/top of dresser/book shelf/window shutters/Window sill),3. 3rd upstairs Bedroom &mdash;&mdash; Vacuum, Dusting (bed frame/top of dresser/book shelf/window shutters/Window sill)4. Downstairs Bedroom -&mdash;&mdash;Vacuum, Dusting (bed frame/top of dresser/book shelf/window shutters/Window sill, TV) COMMUNAL AREAS 0. Family Room &mdash;&mdash;Vacuum (behind chair/under sofa), Dusting (book shelf/window shutters/window sill/ TV/ bookshelf, Mantle, top of Shoe Rack (dust), Behind shoe rack (vacuum), Under bench (vacuum) 1. Living Room &mdash;&mdash;Vacuum, Dusting (window shutters/Window sills/mantle/treadmill) 2. Dining Room -&mdash;&mdash;Vacuum (carpet), Dusting (window shutters/window sills) 3. Outside (front door/back door)&mdash;&mdash; remove Cobwebs around the door entrance/doorbell/door, etc. FLOOR AREAS All Hardwood Floors -&mdash;&mdash;Vacuum, wet mop All Carpet area -&mdash;&mdash;Vacuum All windows -&mdash;&mdash; dusting (shutters/window sill)","Area &mdash;&mdash;Cleaning Tasks BATHROOMS 1. Upstairs Main Bathroom &mdash;&mdash; Sink/Counter, Shower/Shower Glass and Tub (using *Microfiber towels*), Toilet, Dusting (i.e., windows, baseboards, window sills, window shutters) ⁃ NOTE: Main bathroom shower floor is a black tile with black-colored grout, please use the following cleaning solution for the shower floors only. Pls use non-abrasive shower floor Cleaning Solution (Ingredients): &bull; 1 cup of distilled white vinegar &bull; 1 cup of water &bull; Few drops of essential oil for fragrance (e.g., lemon, tea tree, or lavender)&hellip;I can provide this. 2. Upstairs 2nd Bath &mdash;&mdash;Sink/Counter, Shower/ Shower Glass (using *Microfiber towels*), Toilet, DustingNote: You can use bleach or standard cleaning products for upstairs 2nd bathroom that has shower with white tiles. Would like to that to remain white 3. Downstairs Bath &mdash;&mdash;Sink/Counter, Shower/Shower Glass and Tub, Toilet, Dusting BEDROOMS 1. Main Bedroom -&mdash;&mdash;Vacuum, Dusting (desk area, TV counter, fireplace mantel, window shutters/window sill)2. 2nd upstairs Bedroom -&mdash;&mdash;Vacuum, Dusting (bed frame/top of dresser/book shelf/window shutters/Window sill),3. 3rd upstairs Bedroom &mdash;&mdash; Vacuum, Dusting (bed frame/top of dresser/book shelf/window shutters/Window sill)4. Downstairs Bedroom -&mdash;&mdash;Vacuum, Dusting (bed frame/top of dresser/book shelf/window shutters/Window sill, TV) COMMUNAL AREAS 0. Family Room &mdash;&mdash;Vacuum (behind chair/under sofa), Dusting (book shelf/window shutters/window sill/ TV/ bookshelf, Mantle, top of Shoe Rack (dust), Behind shoe rack (vacuum), Under bench (vacuum) 1. Living Room &mdash;&mdash;Vacuum, Dusting (window shutters/Window sills/mantle/treadmill) 2. Dining Room -&mdash;&mdash;Vacuum (carpet), Dusting (window shutters/window sills) 3. Outside (front door/back door)&mdash;&mdash; remove Cobwebs around the door entrance/doorbell/door, etc. FLOOR AREAS All Hardwood Floors -&mdash;&mdash;Vacuum, wet mop All Carpet area -&mdash;&mdash;Vacuum All windows -&mdash;&mdash; dusting (shutters/window sill)","Area &mdash;&mdash;Cleaning Tasks BATHROOMS 1. Upstairs Main Bathroom &mdash;&mdash; Sink/Counter, Shower/Shower Glass and Tub (using *Microfiber towels*), Toilet, Dusting (i.e., windows, baseboards, window sills, window shutters) ⁃ NOTE: Main bathroom shower floor is a black tile with black-colored grout, please use the following cleaning solution for the shower floors only. Pls use non-abrasive shower floor Cleaning Solution (Ingredients): &bull; 1 cup of distilled white vinegar &bull; 1 cup of water &bull; Few drops of essential oil for fragrance (e.g., lemon, tea tree, or lavender)&hellip;I can provide this. 2. Upstairs 2nd Bath &mdash;&mdash;Sink/Counter, Shower/ Shower Glass (using *Microfiber towels*), Toilet, DustingNote: You can use bleach or standard cleaning products for upstairs 2nd bathroom that has shower with white tiles. Would like to that to remain white 3. Downstairs Bath &mdash;&mdash;Sink/Counter, Shower/Shower Glass and Tub, Toilet, Dusting BEDROOMS 1. Main Bedroom -&mdash;&mdash;Vacuum, Dusting (desk area, TV counter, fireplace mantel, window shutters/window sill)2. 2nd upstairs Bedroom -&mdash;&mdash;Vacuum, Dusting (bed frame/top of dresser/book shelf/window shutters/Window sill),3. 3rd upstairs Bedroom &mdash;&mdash; Vacuum, Dusting (bed frame/top of dresser/book shelf/window shutters/Window sill)4. Downstairs Bedroom -&mdash;&mdash;Vacuum, Dusting (bed frame/top of dresser/book shelf/window shutters/Window sill, TV) COMMUNAL AREAS 0. Family Room &mdash;&mdash;Vacuum (behind chair/under sofa), Dusting (book shelf/window shutters/window sill/ TV/ bookshelf, Mantle, top of Shoe Rack (dust), Behind shoe rack (vacuum), Under bench (vacuum) 1. Living Room &mdash;&mdash;Vacuum, Dusting (window shutters/Window sills/mantle/treadmill) 2. Dining Room -&mdash;&mdash;Vacuum (carpet), Dusting (window shutters/window sills) 3. Outside (front door/back door)&mdash;&mdash; remove Cobwebs around the door entrance/doorbell/door, etc. FLOOR AREAS All Hardwood Floors -&mdash;&mdash;Vacuum, wet mop All Carpet area -&mdash;&mdash;Vacuum All windows -&mdash;&mdash; dusting (shutters/window sill)","Area &mdash;&mdash;Cleaning Tasks BATHROOMS 1. Upstairs Main Bathroom &mdash;&mdash; Sink/Counter, Shower/Shower Glass and Tub (using *Microfiber towels*), Toilet, Dusting (i.e., windows, baseboards, window sills, window shutters) ⁃ NOTE: Main bathroom shower floor is a black tile with black-colored grout, please use the following cleaning solution for the shower floors only. Pls use non-abrasive shower floor Cleaning Solution (Ingredients): &bull; 1 cup of distilled white vinegar &bull; 1 cup of water &bull; Few drops of essential oil for fragrance (e.g., lemon, tea tree, or lavender)&hellip;I can provide this. 2. Upstairs 2nd Bath &mdash;&mdash;Sink/Counter, Shower/ Shower Glass (using *Microfiber towels*), Toilet, DustingNote: You can use bleach or standard cleaning products for upstairs 2nd bathroom that has shower with white tiles. Would like to that to remain white 3. Downstairs Bath &mdash;&mdash;Sink/Counter, Shower/Shower Glass and Tub, Toilet, Dusting BEDROOMS 1. Main Bedroom -&mdash;&mdash;Vacuum, Dusting (desk area, TV counter, fireplace mantel, window shutters/window sill)2. 2nd upstairs Bedroom -&mdash;&mdash;Vacuum, Dusting (bed frame/top of dresser/book shelf/window shutters/Window sill),3. 3rd upstairs Bedroom &mdash;&mdash; Vacuum, Dusting (bed frame/top of dresser/book shelf/window shutters/Window sill)4. Downstairs Bedroom -&mdash;&mdash;Vacuum, Dusting (bed frame/top of dresser/book shelf/window shutters/Window sill, TV) COMMUNAL AREAS 0. Family Room &mdash;&mdash;Vacuum (behind chair/under sofa), Dusting (book shelf/window shutters/window sill/ TV/ bookshelf, Mantle, top of Shoe Rack (dust), Behind shoe rack (vacuum), Under bench (vacuum) 1. Living Room &mdash;&mdash;Vacuum, Dusting (window shutters/Window sills/mantle/treadmill) 2. Dining Room -&mdash;&mdash;Vacuum (carpet), Dusting (window shutters/window sills) 3. Outside (front door/back door)&mdash;&mdash; remove Cobwebs around the door entrance/doorbell/door, etc. FLOOR AREAS All Hardwood Floors -&mdash;&mdash;Vacuum, wet mop All Carpet area -&mdash;&mdash;Vacuum All windows -&mdash;&mdash; dusting (shutters/window sill)",500,31,0.00,,Cancelled,,,0.00,0.00,2025-01-15,"[], Mary Moo would like to skip this months cleaning. February will stay the usual.s",0.00,0.00,4,3,3000 - 3499 Sq Ft,,
,,01/23/2025,08:00 AM,2025-01-23T08:00:00-08:00,2025-01-23T11:00:00-08:00,Suchitra,Chari,Suchitra Chari,,false,suchitra_pt@yahoo.com,,"1238 Gusty Loop, Livermore, CA, USA",Livermore,California,="94550",6509182025,0,,238.33,0.00,202.58,175.00,0.00,0.00,175.00,0.00,0.00,0.00,0.00,Cash/Check,,Biweekly Home Cleaning Service,recurring,,0.00,0.00,35.75,0.00,0,,Unassigned,Unassigned,0.00,,,2024-09-26,Prateek Gupta,03:00,Home Cleaning,Form 1,Test Location,0,Service Area,Regular Cleaning,$350 for 2 cleanings per month,,Light dusting of the backyard patio + garage if the time allows.,,"end no more than 15 mins on sweeping &amp; removing visible cowebs in the garage, &amp; 15 mins on the back patio and watering the front door floor cemented patch.",535,36,175.00,$350 for 2 cleanings per month,Cancelled,,,0.00,0.00,2025-01-22,[],0.00,0.00,3,2.5,1000 - 1499 Sq Ft,,One Story
,,01/23/2025,09:30 AM,2025-01-23T09:30:00-08:00,2025-01-23T13:30:00-08:00,Mary,Moo,Mary Moo,,true,eugeneit510@gmail.com,,"3359 Green Meadow Drive, Danville, CA, USA",Danville,California,="94506",4154399839,0,,300.00,0.00,270.00,325.00,0.00,0.00,325.00,0.00,0.00,0.00,0.00,Cash/Check,,Monthly Home Cleaning Service,recurring,,0.00,0.00,30.00,0.00,0,,Unassigned,Unassigned,0.00,,,2024-08-28,Prateek Gupta,04:00,Home Cleaning,Form 1,Test Location,0,Service Area,Regular Cleaning,"Area &mdash;&mdash;Cleaning Tasks BATHROOMS 1. Upstairs Main Bathroom &mdash;&mdash; Sink/Counter, Shower/Shower Glass and Tub (using *Microfiber towels*), Toilet, Dusting (i.e., windows, baseboards, window sills, window shutters) ⁃ NOTE: Main bathroom shower floor is a black tile with black-colored grout, please use the following cleaning solution for the shower floors only. Pls use non-abrasive shower floor Cleaning Solution (Ingredients): &bull; 1 cup of distilled white vinegar &bull; 1 cup of water &bull; Few drops of essential oil for fragrance (e.g., lemon, tea tree, or lavender)&hellip;I can provide this. 2. Upstairs 2nd Bath &mdash;&mdash;Sink/Counter, Shower/ Shower Glass (using *Microfiber towels*), Toilet, DustingNote: You can use bleach or standard cleaning products for upstairs 2nd bathroom that has shower with white tiles. Would like to that to remain white 3. Downstairs Bath &mdash;&mdash;Sink/Counter, Shower/Shower Glass and Tub, Toilet, Dusting BEDROOMS 1. Main Bedroom -&mdash;&mdash;Vacuum, Dusting (desk area, TV counter, fireplace mantel, window shutters/window sill)2. 2nd upstairs Bedroom -&mdash;&mdash;Vacuum, Dusting (bed frame/top of dresser/book shelf/window shutters/Window sill),3. 3rd upstairs Bedroom &mdash;&mdash; Vacuum, Dusting (bed frame/top of dresser/book shelf/window shutters/Window sill)4. Downstairs Bedroom -&mdash;&mdash;Vacuum, Dusting (bed frame/top of dresser/book shelf/window shutters/Window sill, TV) COMMUNAL AREAS 0. Family Room &mdash;&mdash;Vacuum (behind chair/under sofa), Dusting (book shelf/window shutters/window sill/ TV/ bookshelf, Mantle, top of Shoe Rack (dust), Behind shoe rack (vacuum), Under bench (vacuum) 1. Living Room &mdash;&mdash;Vacuum, Dusting (window shutters/Window sills/mantle/treadmill) 2. Dining Room -&mdash;&mdash;Vacuum (carpet), Dusting (window shutters/window sills) 3. Outside (front door/back door)&mdash;&mdash; remove Cobwebs around the door entrance/doorbell/door, etc. FLOOR AREAS All Hardwood Floors -&mdash;&mdash;Vacuum, wet mop All Carpet area -&mdash;&mdash;Vacuum All windows -&mdash;&mdash; dusting (shutters/window sill)","Area &mdash;&mdash;Cleaning Tasks BATHROOMS 1. Upstairs Main Bathroom &mdash;&mdash; Sink/Counter, Shower/Shower Glass and Tub (using *Microfiber towels*), Toilet, Dusting (i.e., windows, baseboards, window sills, window shutters) ⁃ NOTE: Main bathroom shower floor is a black tile with black-colored grout, please use the following cleaning solution for the shower floors only. Pls use non-abrasive shower floor Cleaning Solution (Ingredients): &bull; 1 cup of distilled white vinegar &bull; 1 cup of water &bull; Few drops of essential oil for fragrance (e.g., lemon, tea tree, or lavender)&hellip;I can provide this. 2. Upstairs 2nd Bath &mdash;&mdash;Sink/Counter, Shower/ Shower Glass (using *Microfiber towels*), Toilet, DustingNote: You can use bleach or standard cleaning products for upstairs 2nd bathroom that has shower with white tiles. Would like to that to remain white 3. Downstairs Bath &mdash;&mdash;Sink/Counter, Shower/Shower Glass and Tub, Toilet, Dusting BEDROOMS 1. Main Bedroom -&mdash;&mdash;Vacuum, Dusting (desk area, TV counter, fireplace mantel, window shutters/window sill)2. 2nd upstairs Bedroom -&mdash;&mdash;Vacuum, Dusting (bed frame/top of dresser/book shelf/window shutters/Window sill),3. 3rd upstairs Bedroom &mdash;&mdash; Vacuum, Dusting (bed frame/top of dresser/book shelf/window shutters/Window sill)4. Downstairs Bedroom -&mdash;&mdash;Vacuum, Dusting (bed frame/top of dresser/book shelf/window shutters/Window sill, TV) COMMUNAL AREAS 0. Family Room &mdash;&mdash;Vacuum (behind chair/under sofa), Dusting (book shelf/window shutters/window sill/ TV/ bookshelf, Mantle, top of Shoe Rack (dust), Behind shoe rack (vacuum), Under bench (vacuum) 1. Living Room &mdash;&mdash;Vacuum, Dusting (window shutters/Window sills/mantle/treadmill) 2. Dining Room -&mdash;&mdash;Vacuum (carpet), Dusting (window shutters/window sills) 3. Outside (front door/back door)&mdash;&mdash; remove Cobwebs around the door entrance/doorbell/door, etc. FLOOR AREAS All Hardwood Floors -&mdash;&mdash;Vacuum, wet mop All Carpet area -&mdash;&mdash;Vacuum All windows -&mdash;&mdash; dusting (shutters/window sill)","Area &mdash;&mdash;Cleaning Tasks BATHROOMS 1. Upstairs Main Bathroom &mdash;&mdash; Sink/Counter, Shower/Shower Glass and Tub (using *Microfiber towels*), Toilet, Dusting (i.e., windows, baseboards, window sills, window shutters) ⁃ NOTE: Main bathroom shower floor is a black tile with black-colored grout, please use the following cleaning solution for the shower floors only. Pls use non-abrasive shower floor Cleaning Solution (Ingredients): &bull; 1 cup of distilled white vinegar &bull; 1 cup of water &bull; Few drops of essential oil for fragrance (e.g., lemon, tea tree, or lavender)&hellip;I can provide this. 2. Upstairs 2nd Bath &mdash;&mdash;Sink/Counter, Shower/ Shower Glass (using *Microfiber towels*), Toilet, DustingNote: You can use bleach or standard cleaning products for upstairs 2nd bathroom that has shower with white tiles. Would like to that to remain white 3. Downstairs Bath &mdash;&mdash;Sink/Counter, Shower/Shower Glass and Tub, Toilet, Dusting BEDROOMS 1. Main Bedroom -&mdash;&mdash;Vacuum, Dusting (desk area, TV counter, fireplace mantel, window shutters/window sill)2. 2nd upstairs Bedroom -&mdash;&mdash;Vacuum, Dusting (bed frame/top of dresser/book shelf/window shutters/Window sill),3. 3rd upstairs Bedroom &mdash;&mdash; Vacuum, Dusting (bed frame/top of dresser/book shelf/window shutters/Window sill)4. Downstairs Bedroom -&mdash;&mdash;Vacuum, Dusting (bed frame/top of dresser/book shelf/window shutters/Window sill, TV) COMMUNAL AREAS 0. Family Room &mdash;&mdash;Vacuum (behind chair/under sofa), Dusting (book shelf/window shutters/window sill/ TV/ bookshelf, Mantle, top of Shoe Rack (dust), Behind shoe rack (vacuum), Under bench (vacuum) 1. Living Room &mdash;&mdash;Vacuum, Dusting (window shutters/Window sills/mantle/treadmill) 2. Dining Room -&mdash;&mdash;Vacuum (carpet), Dusting (window shutters/window sills) 3. Outside (front door/back door)&mdash;&mdash; remove Cobwebs around the door entrance/doorbell/door, etc. FLOOR AREAS All Hardwood Floors -&mdash;&mdash;Vacuum, wet mop All Carpet area -&mdash;&mdash;Vacuum All windows -&mdash;&mdash; dusting (shutters/window sill)","Area &mdash;&mdash;Cleaning Tasks BATHROOMS 1. Upstairs Main Bathroom &mdash;&mdash; Sink/Counter, Shower/Shower Glass and Tub (using *Microfiber towels*), Toilet, Dusting (i.e., windows, baseboards, window sills, window shutters) ⁃ NOTE: Main bathroom shower floor is a black tile with black-colored grout, please use the following cleaning solution for the shower floors only. Pls use non-abrasive shower floor Cleaning Solution (Ingredients): &bull; 1 cup of distilled white vinegar &bull; 1 cup of water &bull; Few drops of essential oil for fragrance (e.g., lemon, tea tree, or lavender)&hellip;I can provide this. 2. Upstairs 2nd Bath &mdash;&mdash;Sink/Counter, Shower/ Shower Glass (using *Microfiber towels*), Toilet, DustingNote: You can use bleach or standard cleaning products for upstairs 2nd bathroom that has shower with white tiles. Would like to that to remain white 3. Downstairs Bath &mdash;&mdash;Sink/Counter, Shower/Shower Glass and Tub, Toilet, Dusting BEDROOMS 1. Main Bedroom -&mdash;&mdash;Vacuum, Dusting (desk area, TV counter, fireplace mantel, window shutters/window sill)2. 2nd upstairs Bedroom -&mdash;&mdash;Vacuum, Dusting (bed frame/top of dresser/book shelf/window shutters/Window sill),3. 3rd upstairs Bedroom &mdash;&mdash; Vacuum, Dusting (bed frame/top of dresser/book shelf/window shutters/Window sill)4. Downstairs Bedroom -&mdash;&mdash;Vacuum, Dusting (bed frame/top of dresser/book shelf/window shutters/Window sill, TV) COMMUNAL AREAS 0. Family Room &mdash;&mdash;Vacuum (behind chair/under sofa), Dusting (book shelf/window shutters/window sill/ TV/ bookshelf, Mantle, top of Shoe Rack (dust), Behind shoe rack (vacuum), Under bench (vacuum) 1. Living Room &mdash;&mdash;Vacuum, Dusting (window shutters/Window sills/mantle/treadmill) 2. Dining Room -&mdash;&mdash;Vacuum (carpet), Dusting (window shutters/window sills) 3. Outside (front door/back door)&mdash;&mdash; remove Cobwebs around the door entrance/doorbell/door, etc. FLOOR AREAS All Hardwood Floors -&mdash;&mdash;Vacuum, wet mop All Carpet area -&mdash;&mdash;Vacuum All windows -&mdash;&mdash; dusting (shutters/window sill)","Area &mdash;&mdash;Cleaning Tasks BATHROOMS 1. Upstairs Main Bathroom &mdash;&mdash; Sink/Counter, Shower/Shower Glass and Tub (using *Microfiber towels*), Toilet, Dusting (i.e., windows, baseboards, window sills, window shutters) ⁃ NOTE: Main bathroom shower floor is a black tile with black-colored grout, please use the following cleaning solution for the shower floors only. Pls use non-abrasive shower floor Cleaning Solution (Ingredients): &bull; 1 cup of distilled white vinegar &bull; 1 cup of water &bull; Few drops of essential oil for fragrance (e.g., lemon, tea tree, or lavender)&hellip;I can provide this. 2. Upstairs 2nd Bath &mdash;&mdash;Sink/Counter, Shower/ Shower Glass (using *Microfiber towels*), Toilet, DustingNote: You can use bleach or standard cleaning products for upstairs 2nd bathroom that has shower with white tiles. Would like to that to remain white 3. Downstairs Bath &mdash;&mdash;Sink/Counter, Shower/Shower Glass and Tub, Toilet, Dusting BEDROOMS 1. Main Bedroom -&mdash;&mdash;Vacuum, Dusting (desk area, TV counter, fireplace mantel, window shutters/window sill)2. 2nd upstairs Bedroom -&mdash;&mdash;Vacuum, Dusting (bed frame/top of dresser/book shelf/window shutters/Window sill),3. 3rd upstairs Bedroom &mdash;&mdash; Vacuum, Dusting (bed frame/top of dresser/book shelf/window shutters/Window sill)4. Downstairs Bedroom -&mdash;&mdash;Vacuum, Dusting (bed frame/top of dresser/book shelf/window shutters/Window sill, TV) COMMUNAL AREAS 0. Family Room &mdash;&mdash;Vacuum (behind chair/under sofa), Dusting (book shelf/window shutters/window sill/ TV/ bookshelf, Mantle, top of Shoe Rack (dust), Behind shoe rack (vacuum), Under bench (vacuum) 1. Living Room &mdash;&mdash;Vacuum, Dusting (window shutters/Window sills/mantle/treadmill) 2. Dining Room -&mdash;&mdash;Vacuum (carpet), Dusting (window shutters/window sills) 3. Outside (front door/back door)&mdash;&mdash; remove Cobwebs around the door entrance/doorbell/door, etc. FLOOR AREAS All Hardwood Floors -&mdash;&mdash;Vacuum, wet mop All Carpet area -&mdash;&mdash;Vacuum All windows -&mdash;&mdash; dusting (shutters/window sill)",485,31,325.00,,Cancelled,,,0.00,0.00,2024-12-18,[],0.00,0.00,4,3,3000 - 3499 Sq Ft,,
,,01/26/2025,03:00 PM,2025-01-26T15:00:00-08:00,2025-01-26T18:00:00-08:00,Jalini,Patel,Jalini Patel,,false,jalini_patel@yahoo.com,,"1341 Wilton Road, Livermore, CA, USA",Livermore,California,="94551",5106887469,0,,130.66,0.00,111.06,115.00,0.00,0.00,115.00,0.00,0.00,0.00,0.00,Cash/Check,,Biweekly Home Cleaning Service,recurring,,0.00,0.00,19.60,0.00,0,"[
  {
    Id: 75,
    Name: Nelson \u0026 Ingrid - Tri-Valley
  },
  {
    Email Id: tamurcia11@gmail.com,
    Id: 76,
    Name: Tatiana Murcia - Livermore,
    Payment Amount: 0.00,
    Phone Number: 9256395409
  }
]",75: Nelson & Ingrid - Tri-Valley,Nelson & Ingrid - Tri-Valley,0.00,,,2024-11-06,Prateek Gupta,03:00,Home Cleaning,Form 1,Test Location,0,Service Area,Regular Cleaning,,,,"Just kitchen and 2 bathrooms, nothing else.",Regular Cleaning of - 2 bathrooms + kitchen only. No inside cleaning kitchen appliances.,525,60,115.00,,Cancelled,,"Living Room, Bedroom",0.00,0.00,2025-01-25,[],0.00,0.00,5,2,1 - 999 Sq Ft,,
,,02/01/2025,02:00 PM,2025-02-01T14:00:00-08:00,2025-02-01T18:40:00-08:00,Mary,Noble-Tolla,Mary Noble-Tolla,,true,maryagnesnoble@gmail.com,,"6985 Hillstone Ct, Livermore, CA, 94551",Livermore,California,="",6507989900,0,,393.00,0.00,353.70,350.00,0.00,0.00,350.00,0.00,0.00,0.00,0.00,CC,7153,Monthly Home Cleaning Service,recurring,,0.00,0.00,39.30,0.00,0,,Unassigned,Unassigned,0.00,,,2024-12-05,Mary Noble-Tolla,04:40,Home Cleaning,Form 1,Test Location,0,Service Area,Regular Cleaning,,,,Please change the bed sheets.,Please change the bed sheets.,571,73,350.00,,Cancelled,,,0.00,0.00,2025-01-30,"[], Customer emailed to cancel the service.",0.00,0.00,5,3,3000 - 3499 Sq Ft,,
,,02/09/2025,09:00 AM,2025-02-09T09:00:00-08:00,2025-02-09T12:00:00-08:00,Brent,Cameron,Brent Cameron,,false,bjcameron85@gmail.com,,"2828 Lemon Cmn Livermore, CA",,,="94551",4086004617,0,,276.67,0.00,207.50,170.00,0.00,0.00,170.00,0.00,0.00,0.00,0.00,Cash/Check,,Weekly,recurring,,0.00,0.00,69.17,0.00,0,"[
  {
    Id: 75,
    Name: Nelson \u0026 Ingrid - Tri-Valley
  },
  {
    Email Id: tamurcia11@gmail.com,
    Id: 76,
    Name: Tatiana Murcia - Livermore,
    Payment Amount: 0.00,
    Phone Number: 9256395409
  }
]",75: Nelson & Ingrid - Tri-Valley,Nelson & Ingrid - Tri-Valley,0.00,,,2024-09-16,Prateek Gupta,03:00,Home Cleaning,Form 1,Test Location,0,Service Area,Regular Cleaning,,,,1 loading-unloading of 1 load of laundry + loading of dishwasher. This is a regular cleaning.,1 loading-unloadingof 1 load of laundry + loading of dishwasher. This is a regular cleaning.,491,13,170.00,,Cancelled,,,0.00,0.00,2025-02-02,"[], Customer is moving to another town.",0.00,0.00,3,3.5,1500 - 1999 Sq Ft,,
,,02/09/2025,05:00 PM,2025-02-09T17:00:00-08:00,2025-02-09T20:00:00-08:00,Jalini,Patel,Jalini Patel,,false,jalini_patel@yahoo.com,,"1341 Wilton Road, Livermore, CA, USA",Livermore,California,="94551",5106887469,0,,130.66,0.00,111.06,115.00,0.00,0.00,115.00,0.00,0.00,0.00,0.00,Cash/Check,,Biweekly Home Cleaning Service,recurring,,0.00,0.00,19.60,0.00,0,"[
  {
    Id: 75,
    Name: Nelson \u0026 Ingrid - Tri-Valley
  },
  {
    Email Id: tamurcia11@gmail.com,
    Id: 76,
    Name: Tatiana Murcia - Livermore,
    Payment Amount: 0.00,
    Phone Number: 9256395409
  }
]",75: Nelson & Ingrid - Tri-Valley,Nelson & Ingrid - Tri-Valley,0.00,,,2025-01-25,Prateek Gupta,03:00,Home Cleaning,Form 1,Test Location,0,Service Area,Regular Cleaning,,,,"Just kitchen and 2 bathrooms, nothing else.",Regular Cleaning of - 2 bathrooms + kitchen only. No inside cleaning kitchen appliances.,660,60,115.00,,Cancelled,,"Living Room, Bedroom",0.00,0.00,2025-02-02,[],0.00,0.00,5,2,1 - 999 Sq Ft,,
,,02/14/2025,02:00 PM,2025-02-14T14:00:00-08:00,2025-02-14T18:00:00-08:00,Jaya,Singhal,Jaya Singhal,,false,singhaljaya@gmail.com,,"2859 Feather Road, Manteca, CA, USA",Manteca,California,="95337",4088380687,0,,125.00,0.00,112.50,112.50,0.00,0.00,112.50,0.00,0.00,0.00,0.00,Cash/Check,,Monthly Home Cleaning Service,recurring,,0.00,0.00,12.50,0.00,0,,Unassigned,Unassigned,0.00,,,2024-10-22,Prateek Gupta,04:00,Home Cleaning,Form 1,Test Location,0,Service Area,Regular Cleaning,,,,,,605,9,0.00,,Cancelled,,Bedroom,0.00,0.00,2025-02-03,[],0.00,0.00,4,2.5,1500 - 1999 Sq Ft,,
,,02/20/2025,09:30 AM,2025-02-20T09:30:00-08:00,2025-02-20T13:30:00-08:00,Mary,Moo,Mary Moo,,true,eugeneit510@gmail.com,,"3359 Green Meadow Drive, Danville, CA, USA",Danville,California,="94506",4154399839,0,,300.00,0.00,270.00,325.00,0.00,0.00,325.00,0.00,0.00,0.00,0.00,Cash/Check,,Monthly Home Cleaning Service,recurring,,0.00,0.00,30.00,0.00,0,,Unassigned,Unassigned,0.00,,,2024-08-28,Prateek Gupta,04:00,Home Cleaning,Form 1,Test Location,0,Service Area,Regular Cleaning,"Area &mdash;&mdash;Cleaning Tasks BATHROOMS 1. Upstairs Main Bathroom &mdash;&mdash; Sink/Counter, Shower/Shower Glass and Tub (using *Microfiber towels*), Toilet, Dusting (i.e., windows, baseboards, window sills, window shutters) ⁃ NOTE: Main bathroom shower floor is a black tile with black-colored grout, please use the following cleaning solution for the shower floors only. Pls use non-abrasive shower floor Cleaning Solution (Ingredients): &bull; 1 cup of distilled white vinegar &bull; 1 cup of water &bull; Few drops of essential oil for fragrance (e.g., lemon, tea tree, or lavender)&hellip;I can provide this. 2. Upstairs 2nd Bath &mdash;&mdash;Sink/Counter, Shower/ Shower Glass (using *Microfiber towels*), Toilet, DustingNote: You can use bleach or standard cleaning products for upstairs 2nd bathroom that has shower with white tiles. Would like to that to remain white 3. Downstairs Bath &mdash;&mdash;Sink/Counter, Shower/Shower Glass and Tub, Toilet, Dusting BEDROOMS 1. Main Bedroom -&mdash;&mdash;Vacuum, Dusting (desk area, TV counter, fireplace mantel, window shutters/window sill)2. 2nd upstairs Bedroom -&mdash;&mdash;Vacuum, Dusting (bed frame/top of dresser/book shelf/window shutters/Window sill),3. 3rd upstairs Bedroom &mdash;&mdash; Vacuum, Dusting (bed frame/top of dresser/book shelf/window shutters/Window sill)4. Downstairs Bedroom -&mdash;&mdash;Vacuum, Dusting (bed frame/top of dresser/book shelf/window shutters/Window sill, TV) COMMUNAL AREAS 0. Family Room &mdash;&mdash;Vacuum (behind chair/under sofa), Dusting (book shelf/window shutters/window sill/ TV/ bookshelf, Mantle, top of Shoe Rack (dust), Behind shoe rack (vacuum), Under bench (vacuum) 1. Living Room &mdash;&mdash;Vacuum, Dusting (window shutters/Window sills/mantle/treadmill) 2. Dining Room -&mdash;&mdash;Vacuum (carpet), Dusting (window shutters/window sills) 3. Outside (front door/back door)&mdash;&mdash; remove Cobwebs around the door entrance/doorbell/door, etc. FLOOR AREAS All Hardwood Floors -&mdash;&mdash;Vacuum, wet mop All Carpet area -&mdash;&mdash;Vacuum All windows -&mdash;&mdash; dusting (shutters/window sill)","Area &mdash;&mdash;Cleaning Tasks BATHROOMS 1. Upstairs Main Bathroom &mdash;&mdash; Sink/Counter, Shower/Shower Glass and Tub (using *Microfiber towels*), Toilet, Dusting (i.e., windows, baseboards, window sills, window shutters) ⁃ NOTE: Main bathroom shower floor is a black tile with black-colored grout, please use the following cleaning solution for the shower floors only. Pls use non-abrasive shower floor Cleaning Solution (Ingredients): &bull; 1 cup of distilled white vinegar &bull; 1 cup of water &bull; Few drops of essential oil for fragrance (e.g., lemon, tea tree, or lavender)&hellip;I can provide this. 2. Upstairs 2nd Bath &mdash;&mdash;Sink/Counter, Shower/ Shower Glass (using *Microfiber towels*), Toilet, DustingNote: You can use bleach or standard cleaning products for upstairs 2nd bathroom that has shower with white tiles. Would like to that to remain white 3. Downstairs Bath &mdash;&mdash;Sink/Counter, Shower/Shower Glass and Tub, Toilet, Dusting BEDROOMS 1. Main Bedroom -&mdash;&mdash;Vacuum, Dusting (desk area, TV counter, fireplace mantel, window shutters/window sill)2. 2nd upstairs Bedroom -&mdash;&mdash;Vacuum, Dusting (bed frame/top of dresser/book shelf/window shutters/Window sill),3. 3rd upstairs Bedroom &mdash;&mdash; Vacuum, Dusting (bed frame/top of dresser/book shelf/window shutters/Window sill)4. Downstairs Bedroom -&mdash;&mdash;Vacuum, Dusting (bed frame/top of dresser/book shelf/window shutters/Window sill, TV) COMMUNAL AREAS 0. Family Room &mdash;&mdash;Vacuum (behind chair/under sofa), Dusting (book shelf/window shutters/window sill/ TV/ bookshelf, Mantle, top of Shoe Rack (dust), Behind shoe rack (vacuum), Under bench (vacuum) 1. Living Room &mdash;&mdash;Vacuum, Dusting (window shutters/Window sills/mantle/treadmill) 2. Dining Room -&mdash;&mdash;Vacuum (carpet), Dusting (window shutters/window sills) 3. Outside (front door/back door)&mdash;&mdash; remove Cobwebs around the door entrance/doorbell/door, etc. FLOOR AREAS All Hardwood Floors -&mdash;&mdash;Vacuum, wet mop All Carpet area -&mdash;&mdash;Vacuum All windows -&mdash;&mdash; dusting (shutters/window sill)","Area &mdash;&mdash;Cleaning Tasks BATHROOMS 1. Upstairs Main Bathroom &mdash;&mdash; Sink/Counter, Shower/Shower Glass and Tub (using *Microfiber towels*), Toilet, Dusting (i.e., windows, baseboards, window sills, window shutters) ⁃ NOTE: Main bathroom shower floor is a black tile with black-colored grout, please use the following cleaning solution for the shower floors only. Pls use non-abrasive shower floor Cleaning Solution (Ingredients): &bull; 1 cup of distilled white vinegar &bull; 1 cup of water &bull; Few drops of essential oil for fragrance (e.g., lemon, tea tree, or lavender)&hellip;I can provide this. 2. Upstairs 2nd Bath &mdash;&mdash;Sink/Counter, Shower/ Shower Glass (using *Microfiber towels*), Toilet, DustingNote: You can use bleach or standard cleaning products for upstairs 2nd bathroom that has shower with white tiles. Would like to that to remain white 3. Downstairs Bath &mdash;&mdash;Sink/Counter, Shower/Shower Glass and Tub, Toilet, Dusting BEDROOMS 1. Main Bedroom -&mdash;&mdash;Vacuum, Dusting (desk area, TV counter, fireplace mantel, window shutters/window sill)2. 2nd upstairs Bedroom -&mdash;&mdash;Vacuum, Dusting (bed frame/top of dresser/book shelf/window shutters/Window sill),3. 3rd upstairs Bedroom &mdash;&mdash; Vacuum, Dusting (bed frame/top of dresser/book shelf/window shutters/Window sill)4. Downstairs Bedroom -&mdash;&mdash;Vacuum, Dusting (bed frame/top of dresser/book shelf/window shutters/Window sill, TV) COMMUNAL AREAS 0. Family Room &mdash;&mdash;Vacuum (behind chair/under sofa), Dusting (book shelf/window shutters/window sill/ TV/ bookshelf, Mantle, top of Shoe Rack (dust), Behind shoe rack (vacuum), Under bench (vacuum) 1. Living Room &mdash;&mdash;Vacuum, Dusting (window shutters/Window sills/mantle/treadmill) 2. Dining Room -&mdash;&mdash;Vacuum (carpet), Dusting (window shutters/window sills) 3. Outside (front door/back door)&mdash;&mdash; remove Cobwebs around the door entrance/doorbell/door, etc. FLOOR AREAS All Hardwood Floors -&mdash;&mdash;Vacuum, wet mop All Carpet area -&mdash;&mdash;Vacuum All windows -&mdash;&mdash; dusting (shutters/window sill)","Area &mdash;&mdash;Cleaning Tasks BATHROOMS 1. Upstairs Main Bathroom &mdash;&mdash; Sink/Counter, Shower/Shower Glass and Tub (using *Microfiber towels*), Toilet, Dusting (i.e., windows, baseboards, window sills, window shutters) ⁃ NOTE: Main bathroom shower floor is a black tile with black-colored grout, please use the following cleaning solution for the shower floors only. Pls use non-abrasive shower floor Cleaning Solution (Ingredients): &bull; 1 cup of distilled white vinegar &bull; 1 cup of water &bull; Few drops of essential oil for fragrance (e.g., lemon, tea tree, or lavender)&hellip;I can provide this. 2. Upstairs 2nd Bath &mdash;&mdash;Sink/Counter, Shower/ Shower Glass (using *Microfiber towels*), Toilet, DustingNote: You can use bleach or standard cleaning products for upstairs 2nd bathroom that has shower with white tiles. Would like to that to remain white 3. Downstairs Bath &mdash;&mdash;Sink/Counter, Shower/Shower Glass and Tub, Toilet, Dusting BEDROOMS 1. Main Bedroom -&mdash;&mdash;Vacuum, Dusting (desk area, TV counter, fireplace mantel, window shutters/window sill)2. 2nd upstairs Bedroom -&mdash;&mdash;Vacuum, Dusting (bed frame/top of dresser/book shelf/window shutters/Window sill),3. 3rd upstairs Bedroom &mdash;&mdash; Vacuum, Dusting (bed frame/top of dresser/book shelf/window shutters/Window sill)4. Downstairs Bedroom -&mdash;&mdash;Vacuum, Dusting (bed frame/top of dresser/book shelf/window shutters/Window sill, TV) COMMUNAL AREAS 0. Family Room &mdash;&mdash;Vacuum (behind chair/under sofa), Dusting (book shelf/window shutters/window sill/ TV/ bookshelf, Mantle, top of Shoe Rack (dust), Behind shoe rack (vacuum), Under bench (vacuum) 1. Living Room &mdash;&mdash;Vacuum, Dusting (window shutters/Window sills/mantle/treadmill) 2. Dining Room -&mdash;&mdash;Vacuum (carpet), Dusting (window shutters/window sills) 3. Outside (front door/back door)&mdash;&mdash; remove Cobwebs around the door entrance/doorbell/door, etc. FLOOR AREAS All Hardwood Floors -&mdash;&mdash;Vacuum, wet mop All Carpet area -&mdash;&mdash;Vacuum All windows -&mdash;&mdash; dusting (shutters/window sill)","Area &mdash;&mdash;Cleaning Tasks BATHROOMS 1. Upstairs Main Bathroom &mdash;&mdash; Sink/Counter, Shower/Shower Glass and Tub (using *Microfiber towels*), Toilet, Dusting (i.e., windows, baseboards, window sills, window shutters) ⁃ NOTE: Main bathroom shower floor is a black tile with black-colored grout, please use the following cleaning solution for the shower floors only. Pls use non-abrasive shower floor Cleaning Solution (Ingredients): &bull; 1 cup of distilled white vinegar &bull; 1 cup of water &bull; Few drops of essential oil for fragrance (e.g., lemon, tea tree, or lavender)&hellip;I can provide this. 2. Upstairs 2nd Bath &mdash;&mdash;Sink/Counter, Shower/ Shower Glass (using *Microfiber towels*), Toilet, DustingNote: You can use bleach or standard cleaning products for upstairs 2nd bathroom that has shower with white tiles. Would like to that to remain white 3. Downstairs Bath &mdash;&mdash;Sink/Counter, Shower/Shower Glass and Tub, Toilet, Dusting BEDROOMS 1. Main Bedroom -&mdash;&mdash;Vacuum, Dusting (desk area, TV counter, fireplace mantel, window shutters/window sill)2. 2nd upstairs Bedroom -&mdash;&mdash;Vacuum, Dusting (bed frame/top of dresser/book shelf/window shutters/Window sill),3. 3rd upstairs Bedroom &mdash;&mdash; Vacuum, Dusting (bed frame/top of dresser/book shelf/window shutters/Window sill)4. Downstairs Bedroom -&mdash;&mdash;Vacuum, Dusting (bed frame/top of dresser/book shelf/window shutters/Window sill, TV) COMMUNAL AREAS 0. Family Room &mdash;&mdash;Vacuum (behind chair/under sofa), Dusting (book shelf/window shutters/window sill/ TV/ bookshelf, Mantle, top of Shoe Rack (dust), Behind shoe rack (vacuum), Under bench (vacuum) 1. Living Room &mdash;&mdash;Vacuum, Dusting (window shutters/Window sills/mantle/treadmill) 2. Dining Room -&mdash;&mdash;Vacuum (carpet), Dusting (window shutters/window sills) 3. Outside (front door/back door)&mdash;&mdash; remove Cobwebs around the door entrance/doorbell/door, etc. FLOOR AREAS All Hardwood Floors -&mdash;&mdash;Vacuum, wet mop All Carpet area -&mdash;&mdash;Vacuum All windows -&mdash;&mdash; dusting (shutters/window sill)",608,31,325.00,,Cancelled,,,0.00,0.00,2025-02-06,[],0.00,0.00,4,3,3000 - 3499 Sq Ft,,
,,02/23/2025,04:00 PM,2025-02-23T16:00:00-08:00,2025-02-23T19:00:00-08:00,Suchitra,Chari,Suchitra Chari,,false,suchitra_pt@yahoo.com,,"1238 Gusty Loop, Livermore, CA, USA",Livermore,California,="94550",6509182025,0,,238.33,0.00,202.58,175.00,0.00,0.00,175.00,0.00,0.00,0.00,0.00,Cash/Check,,Biweekly Home Cleaning Service,recurring,,0.00,0.00,35.75,0.00,0,"[
  {
    Id: 75,
    Name: Nelson \u0026 Ingrid - Tri-Valley
  },
  {
    Email Id: tamurcia11@gmail.com,
    Id: 76,
    Name: Tatiana Murcia - Livermore,
    Payment Amount: 0.00,
    Phone Number: 9256395409
  }
]",75: Nelson & Ingrid - Tri-Valley,Nelson & Ingrid - Tri-Valley,0.00,,,2024-09-26,Prateek Gupta,03:00,Home Cleaning,Form 1,Test Location,0,Service Area,Regular Cleaning,$350 for 2 cleanings per month,,Light dusting of the backyard patio + garage if the time allows.,,"end no more than 15 mins on sweeping &amp; removing visible cowebs in the garage, &amp; 15 mins on the back patio and watering the front door floor cemented patch.",640,36,175.00,$350 for 2 cleanings per month,Cancelled,,,0.00,0.00,2025-02-23,[],0.00,0.00,3,2.5,1000 - 1499 Sq Ft,,One Story
,,02/24/2025,02:00 PM,2025-02-24T14:00:00-08:00,2025-02-24T19:00:00-08:00,Alberto,Berkeley,Alberto Berkeley,,false,albertomasm@gmail.com,,"1425 Allston Way, Berkeley, California, USA",Berkeley,California,="",5105011542,0,,450.00,0.00,405.00,380.00,0.00,0.00,380.00,0.00,0.00,0.00,0.00,CC,5666,One-Time Cleaning,onetime,,0.00,45.00,0.00,0.00,0,"[
  {
    Id: 75,
    Name: Nelson \u0026 Ingrid - Tri-Valley
  },
  {
    Email Id: tamurcia11@gmail.com,
    Id: 76,
    Name: Tatiana Murcia - Livermore,
    Payment Amount: 0.00,
    Phone Number: 9256395409
  }
]",75: Nelson & Ingrid - Tri-Valley,Nelson & Ingrid - Tri-Valley,0.00,,,2025-02-23,Alberto Berkeley,05:00,Home Cleaning,Form 1,Test Location,0,Service Area,Deep Cleaning,,,,"- Clients home has two bedrooms, one bathroom, and a basement, with approximately 1200 square feet in Berkeley.∙ Sensitive birds like parrots can be harmed by bleach or Lysol, so use pet-safe products like dish soap or eco-friendly cleaners. ∙ Client requests a list of cleaning products to ensure they are safe for pets before cleaning. For basement - we can use lyso/ our usual cleaning products as the parrot wont be exposed for best cleaning results.- client requested 1 load of laundry of bedding + sheets at the start and make the bed using the washed fresh bedding/sheets. ∙ Client prefers cleaning to be done as soon as possible (monday)","- Clients home has two bedrooms, one bathroom, and a basement, with approximately 1200 square feet in Berkeley.∙ Sensitive birds like parrots can be harmed by bleach or Lysol, so use pet-safe products like dish soap or eco-friendly cleaners. ∙ Client requests a list of cleaning products to ensure they are safe for pets before cleaning. For basement - we can use lyso/ our usual cleaning products as the parrot wont be exposed for best cleaning results.- client requested 1 load of laundry of bedding + sheets at the start and make the bed using the washed fresh bedding/sheets. ∙ Client prefers cleaning to be done as soon as possible (monday)",726,97,380.00,,Cancelled,"Green Cleaning, Pets, Laundry & Folding",,0.00,0.00,2025-02-24,"[], Same Day Cancellation ($50 charged)",0.00,0.00,2,1,1000 - 1499 Sq Ft,,One Story
,,03/03/2025,04:00 PM,2025-03-03T16:00:00-08:00,2025-03-03T19:00:00-08:00,Jalini,Patel,Jalini Patel,,false,jalini_patel@yahoo.com,,"1341 Wilton Road, Livermore, CA, USA",Livermore,California,="94551",5106887469,0,,130.66,0.00,111.06,115.00,0.00,0.00,115.00,0.00,0.00,0.00,0.00,Cash/Check,,Biweekly Home Cleaning Service,recurring,,0.00,0.00,19.60,0.00,0,"[
  {
    Id: 75,
    Name: Nelson \u0026 Ingrid - Tri-Valley
  },
  {
    Email Id: tamurcia11@gmail.com,
    Id: 76,
    Name: Tatiana Murcia - Livermore,
    Payment Amount: 0.00,
    Phone Number: 9256395409
  }
]",75: Nelson & Ingrid - Tri-Valley,Nelson & Ingrid - Tri-Valley,0.00,,,2024-11-06,Prateek Gupta,03:00,Home Cleaning,Form 1,Test Location,0,Service Area,Regular Cleaning,,,,"Just kitchen and 2 bathrooms, nothing else.",Regular Cleaning of - 2 bathrooms + kitchen only. No inside cleaning kitchen appliances.,636,60,115.00,,Cancelled,,"Living Room, Bedroom",0.00,0.00,2025-02-22,[],0.00,0.00,5,2,1 - 999 Sq Ft,,
,,03/07/2025,12:00 PM,2025-03-07T12:00:00-08:00,2025-03-07T15:54:00-08:00,Amiya,Kumar Das,Amiya Kumar Das,,false,amiya.appu1989@gmail.com,,"2016 Westbrook Ln, Livermore, CA 94550, USA",Livermore,California,="",3015419589,0,,190.00,0.00,171.00,170.00,0.00,0.00,170.00,0.00,0.00,0.00,0.00,CC,6427,Monthly Home Cleaning Service,recurring,,0.00,0.00,19.00,0.00,0,"[
  {
    Id: 75,
    Name: Nelson \u0026 Ingrid - Tri-Valley
  },
  {
    Email Id: tamurcia11@gmail.com,
    Id: 76,
    Name: Tatiana Murcia - Livermore,
    Payment Amount: 0.00,
    Phone Number: 9256395409
  }
]",75: Nelson & Ingrid - Tri-Valley,Nelson & Ingrid - Tri-Valley,0.00,,,2024-12-04,Prateek Gupta,03:54,Home Cleaning,Form 1,Test Location,0,Service Area,Regular Cleaning,,,,,,639,58,170.00,,Cancelled,,,0.00,0.00,2025-03-03,[],0.00,0.00,3,2,1000 - 1499 Sq Ft,,
,,03/10/2025,02:00 PM,2025-03-10T14:00:00-07:00,2025-03-10T16:00:00-07:00,Surendra,Bhagi,Surendra Bhagi,439 (without Copay) - Helper Bees,true,carecaoncierge+1@thehelperbees.com,,"6286 Blauer Lane, San Jose, CA, USA",San Jose,California,="95135",4087089720,0,,195.83,0.00,176.25,175.00,0.00,0.00,175.00,0.00,0.00,0.00,0.00,Cash/Check,,Monthly Home Cleaning Service,recurring,,0.00,0.00,19.58,0.00,0,,Unassigned,Unassigned,0.00,,,2025-03-17,Prateek Gupta,02:00,Home Cleaning,Form 1,Test Location,0,Service Area,Regular Cleaning,,Alignment Health Insurance,,,,801,108,175.00,,Cancelled,,,0.00,0.00,2025-03-17,[],0.00,0.00,2,1,1 - 999 Sq Ft,,
,,03/10/2025,02:00 PM,2025-03-10T14:00:00-07:00,2025-03-10T17:10:00-07:00,Nadine,Kleven,Nadine Kleven,451 (with Copay) - Helper Bees,true,craftsluver1959@yahoo.com,,"2613 Turpin Avenue, Riverbank, CA, USA",Riverbank,California,="95367",2095417766,0,,195.83,0.00,195.83,175.00,0.00,0.00,175.00,0.00,0.00,0.00,0.00,Cash/Check,,One-Time Cleaning,onetime,,0.00,0.00,0.00,0.00,0,,Unassigned,Unassigned,0.00,,,2025-03-17,Prateek Gupta,03:10,Home Cleaning,Form 1,Test Location,0,Service Area,Regular Cleaning,,Alignment Health - The Helper Bee,,,,812,110,175.00,,Cancelled,,,0.00,0.00,2025-03-17,[],0.00,0.00,2,1,1 - 999 Sq Ft,,
,,03/14/2025,02:00 PM,2025-03-14T14:00:00-07:00,2025-03-14T18:00:00-07:00,Jaya,Singhal,Jaya Singhal,,false,singhaljaya@gmail.com,,"2859 Feather Road, Manteca, CA, USA",Manteca,California,="95337",4088380687,0,,125.00,0.00,112.50,112.50,0.00,0.00,112.50,0.00,0.00,0.00,0.00,Cash/Check,,Monthly Home Cleaning Service,recurring,,0.00,0.00,12.50,0.00,0,,Unassigned,Unassigned,0.00,,,2024-10-22,Prateek Gupta,04:00,Home Cleaning,Form 1,Test Location,0,Service Area,Regular Cleaning,,,,,,644,9,0.00,,Cancelled,,Bedroom,0.00,0.00,2025-03-17,[],0.00,0.00,4,2.5,1500 - 1999 Sq Ft,,
,,03/26/2025,02:00 PM,2025-03-26T14:00:00-07:00,2025-03-26T16:00:00-07:00,Jalini,Patel,Jalini Patel,,false,jalini_patel@yahoo.com,,"1341 Wilton Road, Livermore, CA, USA",Livermore,California,="94551",5106887469,0,,130.66,0.00,111.06,115.00,0.00,0.00,115.00,0.00,0.00,0.00,0.00,Cash/Check,,Biweekly Home Cleaning Service,recurring,,0.00,0.00,19.60,0.00,0,"[
  {
    Id: 75,
    Name: Nelson \u0026 Ingrid - Tri-Valley
  },
  {
    Email Id: tamurcia11@gmail.com,
    Id: 76,
    Name: Tatiana Murcia - Livermore,
    Payment Amount: 0.00,
    Phone Number: 9256395409
  }
]",75: Nelson & Ingrid - Tri-Valley,Nelson & Ingrid - Tri-Valley,0.00,,,2025-01-25,Prateek Gupta,02:00,Home Cleaning,Form 1,Test Location,0,Service Area,Regular Cleaning,,,,"Just kitchen and 2 bathrooms, nothing else.",Regular Cleaning of - 2 bathrooms + kitchen only. No inside cleaning kitchen appliances.,666,60,115.00,,Cancelled,,"Living Room, Bedroom",0.00,0.00,2025-03-13,[],0.00,0.00,5,2,1 - 999 Sq Ft,,
,,04/07/2025,12:00 PM,2025-04-07T12:00:00-07:00,2025-04-07T15:30:00-07:00,Gwendolynn,Boykin,Gwendolynn Boykin,484 (with Copay) - Helper Bees,false,carecaoncierge+6@thehelperbees.com,,"1053 Station Avenue, Atwater, CA, USA",Atwater,California,="95301",2095823460,0,,250.00,0.00,250.00,250.00,0.00,0.00,250.00,0.00,0.00,0.00,0.00,Cash/Check,,One-Time Cleaning,onetime,,0.00,0.00,0.00,0.00,0,"[
  {
    Email Id: julianadspmartinez@gmail.com,
    Id: 118,
    Name: Juliana Martinez,
    Payment Amount: 0.00,
    Phone Number: 2095055084
  }
]",118: Juliana Martinez,Juliana Martinez,0.00,,,2025-03-21,Prateek Gupta,03:30,Home Cleaning,Form 1,Test Location,0,Service Area,Regular Cleaning,,Customer wants to bring her home to a prestine condition with this cleaning with 2 cleaners (3.5 hrs each),Customer wants to bring her home to a prestine condition with this cleaning with 2 cleaners (3.5 hrs each),,,861,113,250.00,,Cancelled,,,0.00,0.00,2025-04-08,[],0.00,0.00,4,2,2000 - 2499 Sq Ft,,
,,04/09/2025,08:00 AM,2025-04-09T08:00:00-07:00,2025-04-09T14:59:00-07:00,steven,martens,steven martens,,false,kawika.martens@gmail.com,,"502 Bell Avenue, Livermore, CA, USA",Livermore,California,="94550",9257581441,0,,398.33,0.00,358.50,358.50,0.00,0.00,358.50,0.00,0.00,0.00,0.00,CC,1008,Monthly Home Cleaning Service,recurring,,0.00,0.00,39.83,0.00,0,,Unassigned,Unassigned,0.00,,,2025-03-11,steven martens,06:59,Home Cleaning,Form 1,Test Location,0,Service Area,Deep Cleaning,,,,,,773,105,0.00,,Cancelled,Pets,,0.00,0.00,2025-03-11,[],0.00,0.00,3,2,2000 - 2499 Sq Ft,,
,,04/11/2025,02:00 PM,2025-04-11T14:00:00-07:00,2025-04-11T18:00:00-07:00,Jaya,Singhal,Jaya Singhal,,false,singhaljaya@gmail.com,,"2859 Feather Road, Manteca, CA, USA",Manteca,California,="95337",4088380687,0,,125.00,0.00,112.50,112.50,0.00,0.00,112.50,0.00,0.00,0.00,0.00,Cash/Check,,Monthly Home Cleaning Service,recurring,,0.00,0.00,12.50,0.00,0,,Unassigned,Unassigned,0.00,,,2024-10-22,Prateek Gupta,04:00,Home Cleaning,Form 1,Test Location,0,Service Area,Regular Cleaning,,,,,,684,9,0.00,,Cancelled,,Bedroom,0.00,0.00,2025-03-25,[],0.00,0.00,4,2.5,1500 - 1999 Sq Ft,,
,,04/16/2025,10:00 AM,2025-04-16T10:00:00-07:00,2025-04-16T13:00:00-07:00,Surendra,Bhagi,Surendra Bhagi,439 (without Copay) - Helper Bees,true,carecaoncierge+1@thehelperbees.com,,"6286 Blauer Lane, San Jose, CA, USA",San Jose,California,="95135",4087089720,0,,200.83,0.00,180.75,175.00,0.00,0.00,175.00,0.00,0.00,0.00,0.00,Cash/Check,,Monthly Home Cleaning Service,recurring,,0.00,0.00,20.08,0.00,0,"[
  {
    Email Id: nydialarson2023@gmail.com,
    Id: 107,
    Name: Nydia Larson - San Jose,
    Payment Amount: 0.00,
    Phone Number: 5108535076
  }
]",107: Nydia Larson - San Jose,Nydia Larson - San Jose,0.00,,,2025-03-17,Prateek Gupta,03:00,Home Cleaning,Form 1,Test Location,0,Service Area,Regular Cleaning,,Alignment Health Insurance,,"1. Wash and put away dishes, including loading and/or unloading dishwasher 2. Clean (wet wipe) exterior of kitchenappliances 3. Clean (wet wipe) kitchen and bathroomcountertops and backsplash 4. Dust and vacuum 2 rooms of customer choice,surfaces that do not require a ladder ormoving furniture 5. Empty trash cans in all rooms and disposeof trash in designated outdoor receptacle 6. Clean out dryer vent 7. Change bed sheets for one bed, includingremoval of bedding and placement inlaundry hamper or designated area andreplacing with clean sheets and beddingprovided by the member 8. Ensure walkways are clear of trippinghazards9. Vacuum/sweep all finished living space floors (not includingfurniture) 10. Clean exterior and interior of toilets 11. Dust and wet wipe all flat surfaces within reach that do notrequire a ladder or moving furniture 12. Scrub and dry sinks, showers, and fixtures 13. Clean outside surface of kitchen and bathroom cabinets 14. Dust Mantle/shelves/tabletops/electronics/dressers/headboardsin all rooms of finished living space 15. Clean mirrors, glass in picture frames and other glass surfaces,excluding windows 16. Laundry - 2 load max,including washing, drying, folding and putting away in closets, furniture or designated area at members directio","1. Wash and put away dishes, including loading and/or unloading dishwasher 2. Clean (wet wipe) exterior of kitchenappliances 3. Clean (wet wipe) kitchen and bathroomcountertops and backsplash 4. Dust and vacuum 2 rooms of customer choice,surfaces that do not require a ladder ormoving furniture 5. Empty trash cans in all rooms and disposeof trash in designated outdoor receptacle 6. Clean out dryer vent 7. Change bed sheets for one bed, includingremoval of bedding and placement inlaundry hamper or designated area andreplacing with clean sheets and beddingprovided by the member 8. Ensure walkways are clear of trippinghazards9. Vacuum/sweep all finished living space floors (not includingfurniture) 10. Clean exterior and interior of toilets 11. Dust and wet wipe all flat surfaces within reach that do notrequire a ladder or moving furniture 12. Scrub and dry sinks, showers, and fixtures 13. Clean outside surface of kitchen and bathroom cabinets 14. Dust Mantle/shelves/tabletops/electronics/dressers/headboardsin all rooms of finished living space 15. Clean mirrors, glass in picture frames and other glass surfaces,excluding windows 16. Laundry - 2 load max,including washing, drying, folding and putting away in closets, furniture or designated area at members directio",797,108,175.00,,Cancelled,,,0.00,0.00,2025-04-09,[],0.00,0.00,2,1,1000 - 1499 Sq Ft,,
,,04/17/2025,10:00 AM,2025-04-17T10:00:00-07:00,2025-04-17T13:00:00-07:00,Jaya,Singhal,Jaya Singhal,,false,singhaljaya@gmail.com,,"2859 Feather Road, Manteca, CA, USA",Manteca,California,="95337",4088380687,0,,209.66,0.00,178.21,75.00,0.00,0.00,75.00,0.00,0.00,0.00,0.00,Cash/Check,,Biweekly Home Cleaning Service,recurring,,0.00,0.00,31.45,0.00,0,"[
  {
    Email Id: julianadspmartinez@gmail.com,
    Id: 118,
    Name: Juliana Martinez,
    Payment Amount: 75.00,
    Phone Number: 2095055084
  }
]",118: Juliana Martinez,Juliana Martinez,75.00,Juliana Martinez: 75.00,,2025-03-25,Prateek Gupta,03:00,Home Cleaning,Form 1,Test Location,0,Service Area,Regular Cleaning,,,,regular cleaning of 1 bedroom 2 full-bathrooms kitchen living room,"regular cleaning of 1 bedroom, 2 full-bathrooms, kitchen, living room",890,9,75.00,,Cancelled,,,0.00,0.00,2025-05-16,[],0.00,75.00,1,2,1 - 999 Sq Ft,,
,,04/30/2025,11:00 AM,2025-04-30T11:00:00-07:00,2025-04-30T14:00:00-07:00,Jaya,Singhal,Jaya Singhal,,false,singhaljaya@gmail.com,,"2859 Feather Road, Manteca, CA, USA",Manteca,California,="95337",4088380687,0,,209.66,0.00,178.21,75.00,0.00,0.00,75.00,0.00,0.00,0.00,0.00,Cash/Check,,Biweekly Home Cleaning Service,recurring,,0.00,0.00,31.45,0.00,0,,Unassigned,Unassigned,0.00,,,2025-03-25,Prateek Gupta,03:00,Home Cleaning,Form 1,Test Location,0,Service Area,Regular Cleaning,,,,regular cleaning of 1 bedroom 2 full-bathrooms kitchen living room,"regular cleaning of 1 bedroom, 2 full-bathrooms, kitchen, living room",891,9,75.00,,Cancelled,,,0.00,0.00,2025-05-16,[],0.00,0.00,1,2,1 - 999 Sq Ft,,
,,05/05/2025,10:00 AM,2025-05-05T10:00:00-07:00,2025-05-05T13:00:00-07:00,Barbara,Luening,Barbara Luening,,false,carecaoncierge+14@thehelperbees.com,,"1776 12th Street, Reedley, CA, USA",Reedley,California,="93654",5597278745,0,,195.83,0.00,176.25,175.00,0.00,0.00,175.00,0.00,0.00,0.00,0.00,Cash/Check,,Monthly Home Cleaning Service,recurring,,0.00,0.00,19.58,0.00,0,"[
  {
    Email Id: rinagarcia089@gmail.com,
    Id: 129,
    Name: Corina Garcia - Fresno,
    Payment Amount: 0.00,
    Phone Number: 5592466207
  }
]",129: Corina Garcia - Fresno,Corina Garcia - Fresno,0.00,,,2025-03-31,Prateek Gupta,03:00,Home Cleaning,Form 1,Test Location,0,Service Area,Regular Cleaning,$50 co-pay // the helper bee,$50 co-pay // the helper bee,,"1. Wash and put away dishes, includingloading and/or unloading dishwasher 2. Clean (wet wipe) exterior of kitchenappliances 3. Clean (wet wipe) kitchen and bathroomcountertops and backsplash 4. Dust and vacuum 2 rooms of customer choice,surfaces that do not require a ladder ormoving furniture 5. Empty trash cans in all rooms and disposeof trash in designated outdoor receptacle 6. Clean out dryer vent 7. Change bed sheets for one bed, includingremoval of bedding and placement inlaundry hamper or designated area andreplacing with clean sheets and beddingprovided by the member 8. Ensure walkways are clear of trippinghazards9. Vacuum/sweep all finished living space floors (not includingfurniture) 10. Clean exterior and interior of toilets 11. Dust and wet wipe all flat surfaces within reach that do notrequire a ladder or moving furniture 12. Scrub and dry sinks, showers, and fixtures 13. Clean outside surface of kitchen and bathroom cabinets 14. Dust Mantle/shelves/tabletops/electronics/dressers/headboardsin all rooms of finished living space 15. Clean mirrors, glass in picture frames and other glass surfaces,excluding windows 16. Laundry - 2 load max,including washing, drying, folding and putting away in closets, furniture or designated area at members directio","1. Wash and put away dishes, includingloading and/or unloading dishwasher 2. Clean (wet wipe) exterior of kitchenappliances 3. Clean (wet wipe) kitchen and bathroomcountertops and backsplash 4. Dust and vacuum 2 rooms of customer choice,surfaces that do not require a ladder ormoving furniture 5. Empty trash cans in all rooms and disposeof trash in designated outdoor receptacle 6. Clean out dryer vent 7. Change bed sheets for one bed, includingremoval of bedding and placement inlaundry hamper or designated area andreplacing with clean sheets and beddingprovided by the member 8. Ensure walkways are clear of trippinghazards9. Vacuum/sweep all finished living space floors (not includingfurniture) 10. Clean exterior and interior of toilets 11. Dust and wet wipe all flat surfaces within reach that do notrequire a ladder or moving furniture 12. Scrub and dry sinks, showers, and fixtures 13. Clean outside surface of kitchen and bathroom cabinets 14. Dust Mantle/shelves/tabletops/electronics/dressers/headboardsin all rooms of finished living space 15. Clean mirrors, glass in picture frames and other glass surfaces,excluding windows 16. Laundry - 2 load max,including washing, drying, folding and putting away in closets, furniture or designated area at members directio",946,131,175.00,,Cancelled,,,0.00,0.00,2025-04-30,[],0.00,0.00,2,1,1 - 999 Sq Ft,,
,,05/05/2025,10:00 AM,2025-05-05T10:00:00-07:00,2025-05-05T13:00:00-07:00,Maria,Morris,Maria Morris,594 (without Copay) - Helper Bees,true,careconcierge@thehelperbees.com,,"1027 W Dakota Ave apt 122, Fresno, CA, USA",Fresno,California,="93705",5592272261,0,,195.83,0.00,176.25,175.00,0.00,0.00,175.00,0.00,0.00,0.00,0.00,Cash/Check,,Monthly Home Cleaning Service,recurring,,0.00,0.00,19.58,0.00,0,"[
  {
    Email Id: rinagarcia089@gmail.com,
    Id: 129,
    Name: Corina Garcia - Fresno,
    Payment Amount: 0.00,
    Phone Number: 5592466207
  }
]",129: Corina Garcia - Fresno,Corina Garcia - Fresno,0.00,,,2025-05-01,Marianne Panganiban,03:00,Home Cleaning,Form 1,Test Location,0,Service Area,Regular Cleaning,,,,"1. Wash and put away dishes, including loading and/or unloading dishwasher 2. Clean (wet wipe) exterior of kitchen appliances 3. Clean (wet wipe) kitchen and bathroom countertops and backsplash 4. Dust and vacuum 2 rooms of customer choice, surfaces that do not require a ladder or moving furniture 5. Empty trash cans in all rooms and dispose of trash in designated outdoor receptacle 6. Clean out dryer vent 7. Change bed sheets for one bed, including removal of bedding and placement in laundry hamper or designated area and replacing with clean sheets and bedding provided by the member 8. Ensure walkways are clear of tripping hazards9. Vacuum/sweep all finished living space floors (not including furniture) 10. Clean exterior and interior of toilets 11. Dust and wet wipe all flat surfaces within reach that do not require a ladder or moving furniture 12. Scrub and dry sinks, showers, and fixtures 13. Clean outside surface of kitchen and bathroom cabinets 14. Dust Mantle/shelves/tabletops/electronics/dressers/headboards in all rooms of finished living space 15. Clean mirrors, glass in picture frames and other glass surfaces, excluding windows 16. Laundry - 2 load max,including washing, drying, folding and putting away in closets, furniture or designated area at members directio","1. Wash and put away dishes, including loading and/or unloading dishwasher 2. Clean (wet wipe) exterior of kitchen appliances 3. Clean (wet wipe) kitchen and bathroom countertops and backsplash 4. Dust and vacuum 2 rooms of customer choice, surfaces that do not require a ladder or moving furniture 5. Empty trash cans in all rooms and dispose of trash in designated outdoor receptacle 6. Clean out dryer vent 7. Change bed sheets for one bed, including removal of bedding and placement in laundry hamper or designated area and replacing with clean sheets and bedding provided by the member 8. Ensure walkways are clear of tripping hazards9. Vacuum/sweep all finished living space floors (not including furniture) 10. Clean exterior and interior of toilets 11. Dust and wet wipe all flat surfaces within reach that do not require a ladder or moving furniture 12. Scrub and dry sinks, showers, and fixtures 13. Clean outside surface of kitchen and bathroom cabinets 14. Dust Mantle/shelves/tabletops/electronics/dressers/headboards in all rooms of finished living space 15. Clean mirrors, glass in picture frames and other glass surfaces, excluding windows 16. Laundry - 2 load max,including washing, drying, folding and putting away in closets, furniture or designated area at members directio",1141,160,175.00,,Cancelled,,,0.00,0.00,2025-12-26,"[], not serviced",0.00,0.00,2,1,1 - 999 Sq Ft,,
,,05/10/2025,01:00 PM,2025-05-10T13:00:00-07:00,2025-05-10T18:15:00-07:00,Cynthia,Magsaysay,Cynthia Magsaysay,,true,cmagsaysay@gmail.com,,"253 Dollar Mountain Dr, San Jose, CA 95127, USA",San Jose,California,="",4155090793,0,,288.33,0.00,273.33,273.33,0.00,0.00,273.33,0.00,0.00,0.00,0.00,CC,0742,One-Time Cleaning,onetime,,0.00,15.00,0.00,0.00,0,"[
  {
    Email Id: mariimoreno.2009@gmail.com,
    Id: 126,
    Name: Maria Moreno - Livermore/Dublin,
    Payment Amount: 0.00,
    Phone Number: 2092043054
  }
]",126: Maria Moreno - Livermore/Dublin,Maria Moreno - Livermore/Dublin,0.00,,,2025-05-10,Cynthia Magsaysay,05:15,Home Cleaning,Form 1,Test Location,0,Service Area,Deep Cleaning,,,,,,1217,174,0.00,,Cancelled,,Bedroom,0.00,0.00,2025-05-10,[],0.00,0.00,4,2,1500 - 1999 Sq Ft,,
,,05/11/2025,10:00 AM,2025-05-11T10:00:00-07:00,2025-05-11T14:00:00-07:00,Suchitra,Chari,Suchitra Chari,,false,suchitra_pt@yahoo.com,,"1238 Gusty Loop, Livermore, CA, USA",Livermore,California,="94550",6509182025,0,,238.33,0.00,202.58,175.00,0.00,0.00,175.00,0.00,0.00,0.00,0.00,Cash/Check,,Biweekly Home Cleaning Service,recurring,,0.00,0.00,35.75,0.00,0,"[
  {
    Email Id: nydialarson2023@gmail.com,
    Id: 107,
    Name: Nydia Larson - San Jose,
    Payment Amount: 0.00,
    Phone Number: 5108535076
  }
]",107: Nydia Larson - San Jose,Nydia Larson - San Jose,0.00,,,2025-03-25,Prateek Gupta,04:00,Home Cleaning,Form 1,Test Location,0,Service Area,Regular Cleaning,$350 for 2 cleanings per month,,Light dusting of the backyard patio + garage if the time allows.,"Light sweeping &amp; removing visible cowebs in the garage, &amp; dusting of the back patio and watering the front door floor cemented patch.","end no more than 15 mins on sweeping &amp; removing visible cowebs in the garage, &amp; 15 mins on the back patio and watering the front door floor cemented patch.",885,36,175.00,$350 for 2 cleanings per month,Cancelled,,,0.00,0.00,2025-05-10,[],0.00,0.00,3,2.5,1000 - 1499 Sq Ft,,
,,05/19/2025,01:00 PM,2025-05-19T13:00:00-07:00,2025-05-19T16:00:00-07:00,Brent,Cameron,Brent Cameron,,false,bjcameron85@gmail.com,,"2828 Lemon Cmn Livermore, CA",,,="94551",4086004617,0,,276.67,0.00,235.17,180.00,0.00,0.00,180.00,0.00,0.00,0.00,0.00,Cash/Check,,Biweekly Home Cleaning Service,recurring,,0.00,0.00,41.50,0.00,0,"[
  {
    Id: 75,
    Name: Nelson \u0026 Ingrid - Tri-Valley
  },
  {
    Email Id: tamurcia11@gmail.com,
    Id: 76,
    Name: Tatiana Murcia - Livermore,
    Payment Amount: 0.00,
    Phone Number: 9256395409
  }
]",75: Nelson & Ingrid - Tri-Valley,Nelson & Ingrid - Tri-Valley,0.00,,,2025-04-04,Prateek Gupta,03:00,Home Cleaning,Form 1,Test Location,0,Service Area,Regular Cleaning,,,,1 loading-unloading of 1 load of laundry + loading of dishwasher. This is a regular cleaning.,1 loading-unloadingof 1 load of laundry + loading of dishwasher. This is a regular cleaning.,967,13,180.00,,Cancelled,,,0.00,0.00,2025-05-14,[],0.00,0.00,3,3.5,1500 - 1999 Sq Ft,,
,,05/19/2025,01:00 PM,2025-05-19T13:00:00-07:00,2025-05-19T16:00:00-07:00,Marlene,Isaak,Marlene Isaak,435 (without Copay) - Helper Bees,false,carecaoncierge+11@thehelperbees.com,120,"7150 N Maple Ave, Fresno, CA, USA",Fresno,California,="93720",5592888683,0,,195.83,0.00,176.25,175.00,0.00,0.00,175.00,0.00,0.00,0.00,0.00,Cash/Check,,Monthly Home Cleaning Service,recurring,,0.00,0.00,19.58,0.00,0,"[
  {
    Email Id: rinagarcia089@gmail.com,
    Id: 129,
    Name: Corina Garcia - Fresno,
    Payment Amount: 0.00,
    Phone Number: 5592466207
  }
]",129: Corina Garcia - Fresno,Corina Garcia - Fresno,0.00,,,2025-04-18,Prateek Gupta,03:00,Home Cleaning,Form 1,Test Location,0,Service Area,Regular Cleaning,,Alignment Health - The Helper Beer,,"1. Wash and put away dishes, includingloading and/or unloading dishwasher 2. Clean (wet wipe) exterior of kitchenappliances 3. Clean (wet wipe) kitchen and bathroomcountertops and backsplash 4. Dust and vacuum 2 rooms of customer choice,surfaces that do not require a ladder ormoving furniture 5. Empty trash cans in all rooms and disposeof trash in designated outdoor receptacle 6. Clean out dryer vent 7. Change bed sheets for one bed, includingremoval of bedding and placement inlaundry hamper or designated area andreplacing with clean sheets and beddingprovided by the member 8. Ensure walkways are clear of trippinghazards9. Vacuum/sweep all finished living space floors (not includingfurniture) 10. Clean exterior and interior of toilets 11. Dust and wet wipe all flat surfaces within reach that do notrequire a ladder or moving furniture 12. Scrub and dry sinks, showers, and fixtures 13. Clean outside surface of kitchen and bathroom cabinets 14. Dust Mantle/shelves/tabletops/electronics/dressers/headboardsin all rooms of finished living space 15. Clean mirrors, glass in picture frames and other glass surfaces,excluding windows 16. Laundry - 2 load max,including washing, drying, folding and putting away in closets, furniture or designated area at members directio","1. Wash and put away dishes, includingloading and/or unloading dishwasher 2. Clean (wet wipe) exterior of kitchenappliances 3. Clean (wet wipe) kitchen and bathroomcountertops and backsplash 4. Dust and vacuum 2 rooms of customer choice,surfaces that do not require a ladder ormoving furniture 5. Empty trash cans in all rooms and disposeof trash in designated outdoor receptacle 6. Clean out dryer vent 7. Change bed sheets for one bed, includingremoval of bedding and placement inlaundry hamper or designated area andreplacing with clean sheets and beddingprovided by the member 8. Ensure walkways are clear of trippinghazards9. Vacuum/sweep all finished living space floors (not includingfurniture) 10. Clean exterior and interior of toilets 11. Dust and wet wipe all flat surfaces within reach that do notrequire a ladder or moving furniture 12. Scrub and dry sinks, showers, and fixtures 13. Clean outside surface of kitchen and bathroom cabinets 14. Dust Mantle/shelves/tabletops/electronics/dressers/headboardsin all rooms of finished living space 15. Clean mirrors, glass in picture frames and other glass surfaces,excluding windows 16. Laundry - 2 load max,including washing, drying, folding and putting away in closets, furniture or designated area at members directio",1046,119,175.00,,Cancelled,,,0.00,0.00,2025-04-29,[],0.00,0.00,2,1,1 - 999 Sq Ft,,
,,05/20/2025,12:00 PM,2025-05-20T12:00:00-07:00,2025-05-20T15:00:00-07:00,Gwendolynn,Boykin,Gwendolynn Boykin,484 (with Copay) - Helper Bees,true,carecaoncierge+6@thehelperbees.com,,"1053 Station Avenue, Atwater, CA, USA",Atwater,California,="95301",2095823460,0,,200.83,0.00,180.75,175.00,0.00,0.00,175.00,0.00,0.00,0.00,0.00,Cash/Check,,Monthly Home Cleaning Service,recurring,,0.00,0.00,20.08,0.00,0,,Unassigned,Unassigned,0.00,,,2025-03-19,Prateek Gupta,03:00,Home Cleaning,Form 1,Test Location,0,Service Area,Regular Cleaning,,Customer wants to bring her home to a prestine condition with this cleaning with 2 cleaners (3.5 hrs each),,"1. Wash and put away dishes, includingloading and/or unloading dishwasher 2. Clean (wet wipe) exterior of kitchenappliances 3. Clean (wet wipe) kitchen and bathroomcountertops and backsplash 4. Dust and vacuum 2 rooms of customer choice,surfaces that do not require a ladder ormoving furniture 5. Empty trash cans in all rooms and disposeof trash in designated outdoor receptacle 6. Clean out dryer vent 7. Change bed sheets for one bed, includingremoval of bedding and placement inlaundry hamper or designated area andreplacing with clean sheets and beddingprovided by the member 8. Ensure walkways are clear of trippinghazards9. Vacuum/sweep all finished living space floors (not includingfurniture) 10. Clean exterior and interior of toilets 11. Dust and wet wipe all flat surfaces within reach that do notrequire a ladder or moving furniture 12. Scrub and dry sinks, showers, and fixtures 13. Clean outside surface of kitchen and bathroom cabinets 14. Dust Mantle/shelves/tabletops/electronics/dressers/headboardsin all rooms of finished living space 15. Clean mirrors, glass in picture frames and other glass surfaces,excluding windows 16. Laundry - 2 load max,including washing, drying, folding and putting away in closets, furniture or designated area at members directio","1. Wash and put away dishes, includingloading and/or unloading dishwasher 2. Clean (wet wipe) exterior of kitchenappliances 3. Clean (wet wipe) kitchen and bathroomcountertops and backsplash 4. Dust and vacuum 2 rooms of customer choice,surfaces that do not require a ladder ormoving furniture 5. Empty trash cans in all rooms and disposeof trash in designated outdoor receptacle 6. Clean out dryer vent 7. Change bed sheets for one bed, includingremoval of bedding and placement inlaundry hamper or designated area andreplacing with clean sheets and beddingprovided by the member 8. Ensure walkways are clear of trippinghazards9. Vacuum/sweep all finished living space floors (not includingfurniture) 10. Clean exterior and interior of toilets 11. Dust and wet wipe all flat surfaces within reach that do notrequire a ladder or moving furniture 12. Scrub and dry sinks, showers, and fixtures 13. Clean outside surface of kitchen and bathroom cabinets 14. Dust Mantle/shelves/tabletops/electronics/dressers/headboardsin all rooms of finished living space 15. Clean mirrors, glass in picture frames and other glass surfaces,excluding windows 16. Laundry - 2 load max,including washing, drying, folding and putting away in closets, furniture or designated area at members directio",877,113,175.00,,Cancelled,,,0.00,0.00,2025-04-28,[],0.00,0.00,2,1,1000 - 1499 Sq Ft,,
,,05/20/2025,03:00 PM,2025-05-20T15:00:00-07:00,2025-05-20T17:16:00-07:00,Bhavani,BHAMIDIPATY,Bhavani BHAMIDIPATY,,false,bhavanibhamidipaty@gmail.com,,"644 Edgewater Blvd apt 102, Foster City, CA, USA",Foster City,California,="94404",9176607611,0,,176.33,0.00,149.88,172.36,0.00,0.00,172.36,22.48,0.00,0.00,0.00,CC,2281,Biweekly Home Cleaning Service,recurring,,0.00,0.00,26.45,0.00,0,,Unassigned,Unassigned,0.00,,,2025-02-22,Bhavani BHAMIDIPATY,02:16,Home Cleaning,Form 1,Test Location,0,Service Area,Regular Cleaning,,,,,,854,95,0.00,,Cancelled,,,0.00,0.00,2025-05-05,[],0.00,0.00,1,1,1 - 999 Sq Ft,,
,,05/22/2025,12:30 PM,2025-05-22T12:30:00-07:00,2025-05-22T18:30:00-07:00,Deepthi,Vivekanand,Deepthi Vivekanand,,false,deepsminu26@gmail.com,,"2109 Shoreline Drive, Manteca, CA, USA",Manteca,California,="95337",6692460109,0,,475.00,0.00,475.00,400.00,0.00,0.00,400.00,0.00,0.00,0.00,0.00,Cash/Check,,One-Time Cleaning,onetime,,0.00,0.00,0.00,0.00,0,"[
  {
    Email Id: mariimoreno.2009@gmail.com,
    Id: 126,
    Name: Maria Moreno - Livermore/Dublin,
    Payment Amount: 0.00,
    Phone Number: 2092043054
  }
]",126: Maria Moreno - Livermore/Dublin,Maria Moreno - Livermore/Dublin,0.00,,,2025-05-20,Prateek Gupta,06:00,Home Cleaning,Form 1,Test Location,0,Service Area,Deep Cleaning,,,,"Please do the following:1. vacuum on the rugs and the mop the floor under the rugs. 2. Upstairs is all carpet - vacuuming is required. 3. Clean the windows/glass, 4. Sweep &amp; mop all the floors, 5. wet wipe the baseboard, door &amp; window frames &amp; sills6. exterior cleaning of all kitchen appliances, 7. scrub the bathroom, 8. clean behind &amp; base of the toilets. 9. Polish the sink, 10. clean the microwave from inside.11. dust &amp; wet wipe all the surface, shelves, photo frames, furniture","Please do the following:1. vacuum on the rugs and the mop the floor under the rugs.2. Upstairs is all carpet - vacuuming is required.3. Clean the windows/glass,4. Sweep &amp; mop all the floors,5. wet wipe the baseboard, door &amp; window frames &amp; sills6. exterior cleaning of all kitchen appliances,7. scrub the bathroom,8. clean behind &amp; base of the toilets.9. Polish the sink,10. clean the microwave from inside.11. dust &amp; wet wipe all the surface, shelves, photo frames, furniture",1329,194,400.00,,Cancelled,,,0.00,0.00,2025-05-22,[],0.00,0.00,5,3.5,3000 - 3499 Sq Ft,,
,,05/24/2025,11:00 AM,2025-05-24T11:00:00-07:00,2025-05-24T14:00:00-07:00,Manjula,Bhagi,Manjula Bhagi,495 (without Copay) - Helper Bees,false,carecaoncierge+12@thehelperbees.com,,"6286 Blauer Lane, San Jose, CA, USA",San Jose,California,="95135",4087089720,0,,200.83,0.00,180.75,175.00,0.00,0.00,175.00,0.00,0.00,0.00,0.00,Cash/Check,,Monthly Home Cleaning Service,recurring,,0.00,0.00,20.08,0.00,0,"[
  {
    Email Id: nydialarson2023@gmail.com,
    Id: 107,
    Name: Nydia Larson - San Jose,
    Payment Amount: 0.00,
    Phone Number: 5108535076
  }
]",107: Nydia Larson - San Jose,Nydia Larson - San Jose,0.00,,,2025-03-19,Prateek Gupta,03:00,Home Cleaning,Form 1,Test Location,0,Service Area,Regular Cleaning,,Alignment Health - Helper Bee,,"1. Wash and put away dishes, includingloading and/or unloading dishwasher 2. Clean (wet wipe) exterior of kitchenappliances 3. Clean (wet wipe) kitchen and bathroomcountertops and backsplash 4. Dust and vacuum 2 rooms of customer choice,surfaces that do not require a ladder ormoving furniture 5. Empty trash cans in all rooms and disposeof trash in designated outdoor receptacle 6. Clean out dryer vent 7. Change bed sheets for one bed, includingremoval of bedding and placement inlaundry hamper or designated area andreplacing with clean sheets and beddingprovided by the member 8. Ensure walkways are clear of trippinghazards9. Vacuum/sweep all finished living space floors (not includingfurniture) 10. Clean exterior and interior of toilets 11. Dust and wet wipe all flat surfaces within reach that do notrequire a ladder or moving furniture 12. Scrub and dry sinks, showers, and fixtures 13. Clean outside surface of kitchen and bathroom cabinets 14. Dust Mantle/shelves/tabletops/electronics/dressers/headboardsin all rooms of finished living space 15. Clean mirrors, glass in picture frames and other glass surfaces,excluding windows 16. Laundry - 2 load max,including washing, drying, folding and putting away in closets, furniture or designated area at members directio","1. Wash and put away dishes, includingloading and/or unloading dishwasher 2. Clean (wet wipe) exterior of kitchenappliances 3. Clean (wet wipe) kitchen and bathroomcountertops and backsplash 4. Dust and vacuum 2 rooms of customer choice,surfaces that do not require a ladder ormoving furniture 5. Empty trash cans in all rooms and disposeof trash in designated outdoor receptacle 6. Clean out dryer vent 7. Change bed sheets for one bed, includingremoval of bedding and placement inlaundry hamper or designated area andreplacing with clean sheets and beddingprovided by the member 8. Ensure walkways are clear of trippinghazards9. Vacuum/sweep all finished living space floors (not includingfurniture) 10. Clean exterior and interior of toilets 11. Dust and wet wipe all flat surfaces within reach that do notrequire a ladder or moving furniture 12. Scrub and dry sinks, showers, and fixtures 13. Clean outside surface of kitchen and bathroom cabinets 14. Dust Mantle/shelves/tabletops/electronics/dressers/headboardsin all rooms of finished living space 15. Clean mirrors, glass in picture frames and other glass surfaces,excluding windows 16. Laundry - 2 load max,including washing, drying, folding and putting away in closets, furniture or designated area at members directio",850,120,175.00,,Cancelled,,,0.00,0.00,2025-05-24,[],0.00,0.00,2,1,1000 - 1499 Sq Ft,,
,,05/27/2025,01:00 PM,2025-05-27T13:00:00-07:00,2025-05-27T16:00:00-07:00,Pamela,Briscoe,Pamela Briscoe,633 (without Copay) - Helper Bees ,false,careconcierge+25@thehelperbees.com,APT 117,"330 West Sierra Avenue, Fresno, CA, USA",Fresno,California,="93704",5592811233,0,,195.83,0.00,176.25,175.00,0.00,0.00,175.00,0.00,0.00,0.00,0.00,Cash/Check,,Monthly Home Cleaning Service,recurring,,0.00,0.00,19.58,0.00,0,"[
  {
    Email Id: monicaann1987@gmail.com,
    Id: 182,
    Name: Monica Marquez - Selma,
    Payment Amount: 0.00,
    Phone Number: 5597488919
  }
]",182: Monica Marquez - Selma,Monica Marquez - Selma,0.00,,,2025-04-22,Prateek Gupta,03:00,Home Cleaning,Form 1,Test Location,0,Service Area,Regular Cleaning,,,,Gated Communtity Use Code "#2024"Apartment Directions - 1st apartment as they come in - middle section (left side) Park behind the garage - no where else parking available Call Pamela if need any assistance - 5592811233 if you cant find or have trouble parking,"1. Wash and put away dishes, includingloading and/or unloading dishwasher 2. Clean (wet wipe) exterior of kitchenappliances 3. Clean (wet wipe) kitchen and bathroomcountertops and backsplash 4. Dust and vacuum 2 rooms of customer choice,surfaces that do not require a ladder ormoving furniture 5. Empty trash cans in all rooms and disposeof trash in designated outdoor receptacle 6. Clean out dryer vent 7. Change bed sheets for one bed, includingremoval of bedding and placement inlaundry hamper or designated area andreplacing with clean sheets and beddingprovided by the member 8. Ensure walkways are clear of trippinghazards9. Vacuum/sweep all finished living space floors (not includingfurniture) 10. Clean exterior and interior of toilets 11. Dust and wet wipe all flat surfaces within reach that do notrequire a ladder or moving furniture 12. Scrub and dry sinks, showers, and fixtures 13. Clean outside surface of kitchen and bathroom cabinets 14. Dust Mantle/shelves/tabletops/electronics/dressers/headboardsin all rooms of finished living space 15. Clean mirrors, glass in picture frames and other glass surfaces,excluding windows 16. Laundry - 2 load max,including washing, drying, folding and putting away in closets, furniture or designated area at members directio",1071,149,175.00,,Cancelled,,,0.00,0.00,2025-05-26,"[], Clients request",0.00,0.00,2,1,1 - 999 Sq Ft,,
,,05/28/2025,10:30 AM,2025-05-28T10:30:00-07:00,2025-05-28T13:30:00-07:00,Larry,Palleschi,Larry Palleschi,,true,drpb@att.net,,"4224 Blue Gum Avenue, Modesto, CA, USA",Modesto,California,="95358",8185544128,0,,195.83,0.00,176.25,175.00,0.00,0.00,175.00,0.00,0.00,0.00,0.00,Cash/Check,,Monthly Home Cleaning Service,recurring,,0.00,0.00,19.58,0.00,0,"[
  {
    Email Id: mp143dlt@gmail.com,
    Id: 154,
    Name: Mikala Price - Modesto,
    Payment Amount: 0.00,
    Phone Number: 2096467555
  }
]",154: Mikala Price - Modesto,Mikala Price - Modesto,0.00,,,2025-05-20,Prateek Gupta,03:00,Home Cleaning,Form 1,Test Location,0,Service Area,Regular Cleaning,,,,"1. Wash and put away dishes, includingloading and/or unloading dishwasher 2. Clean (wet wipe) exterior of kitchenappliances 3. Clean (wet wipe) kitchen and bathroomcountertops and backsplash 4. Dust and vacuum 2 rooms of customer choice,surfaces that do not require a ladder ormoving furniture 5. Empty trash cans in all rooms and disposeof trash in designated outdoor receptacle 6. Clean out dryer vent 7. Change bed sheets for one bed, includingremoval of bedding and placement inlaundry hamper or designated area andreplacing with clean sheets and beddingprovided by the member 8. Ensure walkways are clear of trippinghazards9. Vacuum/sweep all finished living space floors (not includingfurniture) 10. Clean exterior and interior of toilets 11. Dust and wet wipe all flat surfaces within reach that do notrequire a ladder or moving furniture 12. Scrub and dry sinks, showers, and fixtures 13. Clean outside surface of kitchen and bathroom cabinets 14. Dust Mantle/shelves/tabletops/electronics/dressers/headboardsin all rooms of finished living space 15. Clean mirrors, glass in picture frames and other glass surfaces,excluding windows 16. Laundry - 2 load max,including washing, drying, folding and putting away in closets, furniture or designated area at members directio","1. Wash and put away dishes, includingloading and/or unloading dishwasher 2. Clean (wet wipe) exterior of kitchenappliances 3. Clean (wet wipe) kitchen and bathroomcountertops and backsplash 4. Dust and vacuum 2 rooms of customer choice,surfaces that do not require a ladder ormoving furniture 5. Empty trash cans in all rooms and disposeof trash in designated outdoor receptacle 6. Clean out dryer vent 7. Change bed sheets for one bed, includingremoval of bedding and placement inlaundry hamper or designated area andreplacing with clean sheets and beddingprovided by the member 8. Ensure walkways are clear of trippinghazards9. Vacuum/sweep all finished living space floors (not includingfurniture) 10. Clean exterior and interior of toilets 11. Dust and wet wipe all flat surfaces within reach that do notrequire a ladder or moving furniture 12. Scrub and dry sinks, showers, and fixtures 13. Clean outside surface of kitchen and bathroom cabinets 14. Dust Mantle/shelves/tabletops/electronics/dressers/headboardsin all rooms of finished living space 15. Clean mirrors, glass in picture frames and other glass surfaces,excluding windows 16. Laundry - 2 load max,including washing, drying, folding and putting away in closets, furniture or designated area at members directio",1313,192,175.00,,Cancelled,,,0.00,0.00,2025-05-27,[],0.00,0.00,2,1,1 - 999 Sq Ft,,
,,05/30/2025,08:00 AM,2025-05-30T08:00:00-07:00,2025-05-30T14:00:00-07:00,Justin,Li,Justin Li,,false,justin.jie.li@gmail.com,,"561 Fiesta Dr, San Mateo, CA, USA",San Mateo,California,="",4083099681,0,,616.66,0.00,591.66,591.66,0.00,0.00,591.66,0.00,0.00,0.00,0.00,CC,1859,One-Time Cleaning,onetime,MOM25,25.00,0.00,0.00,0.00,0,,Unassigned,Unassigned,0.00,,,2025-05-16,Justin Li,06:00,Home Cleaning,Form 1,Test Location,0,Service Area,Move-in/Move-out,,,,"Move in Cleaning with 3 room carpet cleaning400sqft carpet area.We may add additional extras such as inside cabinets, fridge, etc. However, we first need to check the home and then will provide update.",,1262,180,0.00,,Cancelled,Carpet Shampooing,,0.00,0.00,2025-05-16,[],0.00,0.00,3,2,1500 - 1999 Sq Ft,,
,,05/30/2025,02:00 PM,2025-05-30T14:00:00-07:00,2025-05-30T16:00:00-07:00,Hemalatha,Vangala,Hemalatha Vangala,,false,hema.vangala@gmail.com,,"4531 Middle Park Drive, San Jose, CA, USA",San Jose,California,="95135",4086371488,0,,160.00,0.00,160.00,176.00,0.00,0.00,176.00,16.00,0.00,0.00,0.00,Cash/Check,,One-Time Cleaning,onetime,,0.00,0.00,0.00,0.00,0,,Unassigned,Unassigned,0.00,,,2025-05-23,Hemalatha Vangala,02:00,Hourly Cleaning,Form 5,Test Location,0,Service Area,3 hrs of home cleaning,,,,,,1366,201,0.00,,Cancelled,,,0.00,0.00,2025-05-27,"[], Cancelled booking upon customers request. ",0.00,0.00,,,,,
,,05/31/2025,09:00 AM,2025-05-31T09:00:00-07:00,2025-05-31T13:45:00-07:00,Dushhyanthra,Rajaram,Dushhyanthra Rajaram,,true,dushhyanthrajaram@gmail.com,,"3034 Machado Avenue, Santa Clara, CA, USA",Santa Clara,California,="",4049011551,0,,359.00,0.00,344.00,344.00,0.00,0.00,344.00,0.00,0.00,0.00,0.00,Cash/Check,,One-Time Cleaning,onetime,,0.00,15.00,0.00,0.00,0,,Unassigned,Unassigned,0.00,,,2025-05-27,Dushhyanthra Rajaram,04:45,Home Cleaning,Form 1,Test Location,0,Service Area,Deep Cleaning,,,,,,1399,206,0.00,,Cancelled,"Inside Cabinets, Inside Fridge",,0.00,0.00,2025-05-31,[],0.00,0.00,3,2,1500 - 1999 Sq Ft,,
,,06/01/2025,10:00 AM,2025-06-01T10:00:00-07:00,2025-06-01T13:00:00-07:00,Surendra,Bhagi,Surendra Bhagi,439 (without Copay) - Helper Bees,true,carecaoncierge+1@thehelperbees.com,,"6286 Blauer Lane, San Jose, CA, USA",San Jose,California,="95135",4087089720,0,,195.83,0.00,176.25,175.00,0.00,0.00,175.00,0.00,0.00,0.00,0.00,Cash/Check,,Monthly Home Cleaning Service,recurring,,0.00,0.00,19.58,0.00,0,"[
  {
    Email Id: nydialarson2023@gmail.com,
    Id: 107,
    Name: Nydia Larson - San Jose,
    Payment Amount: 0.00,
    Phone Number: 5108535076
  }
]",107: Nydia Larson - San Jose,Nydia Larson - San Jose,0.00,,,2025-03-17,Prateek Gupta,03:00,Home Cleaning,Form 1,Test Location,0,Service Area,Regular Cleaning,,Alignment Health Insurance,,,,806,108,175.00,,Cancelled,,,0.00,0.00,2025-05-18,"[], double booking",0.00,0.00,2,1,1 - 999 Sq Ft,,One Story
,,06/02/2025,10:00 AM,2025-06-02T10:00:00-07:00,2025-06-02T13:00:00-07:00,Barbara,Luening,Barbara Luening,,false,carecaoncierge+14@thehelperbees.com,,"1776 12th Street, Reedley, CA, USA",Reedley,California,="93654",5597278745,0,,195.83,0.00,176.25,175.00,0.00,0.00,175.00,0.00,0.00,0.00,0.00,Cash/Check,,Monthly Home Cleaning Service,recurring,,0.00,0.00,19.58,0.00,0,"[
  {
    Email Id: rinagarcia089@gmail.com,
    Id: 129,
    Name: Corina Garcia - Fresno,
    Payment Amount: 0.00,
    Phone Number: 5592466207
  }
]",129: Corina Garcia - Fresno,Corina Garcia - Fresno,0.00,,,2025-03-31,Prateek Gupta,03:00,Home Cleaning,Form 1,Test Location,0,Service Area,Regular Cleaning,$50 co-pay // the helper bee,$50 co-pay // the helper bee,,"1. Wash and put away dishes, includingloading and/or unloading dishwasher 2. Clean (wet wipe) exterior of kitchenappliances 3. Clean (wet wipe) kitchen and bathroomcountertops and backsplash 4. Dust and vacuum 2 rooms of customer choice,surfaces that do not require a ladder ormoving furniture 5. Empty trash cans in all rooms and disposeof trash in designated outdoor receptacle 6. Clean out dryer vent 7. Change bed sheets for one bed, includingremoval of bedding and placement inlaundry hamper or designated area andreplacing with clean sheets and beddingprovided by the member 8. Ensure walkways are clear of trippinghazards9. Vacuum/sweep all finished living space floors (not includingfurniture) 10. Clean exterior and interior of toilets 11. Dust and wet wipe all flat surfaces within reach that do notrequire a ladder or moving furniture 12. Scrub and dry sinks, showers, and fixtures 13. Clean outside surface of kitchen and bathroom cabinets 14. Dust Mantle/shelves/tabletops/electronics/dressers/headboardsin all rooms of finished living space 15. Clean mirrors, glass in picture frames and other glass surfaces,excluding windows 16. Laundry - 2 load max,including washing, drying, folding and putting away in closets, furniture or designated area at members directio","1. Wash and put away dishes, includingloading and/or unloading dishwasher 2. Clean (wet wipe) exterior of kitchenappliances 3. Clean (wet wipe) kitchen and bathroomcountertops and backsplash 4. Dust and vacuum 2 rooms of customer choice,surfaces that do not require a ladder ormoving furniture 5. Empty trash cans in all rooms and disposeof trash in designated outdoor receptacle 6. Clean out dryer vent 7. Change bed sheets for one bed, includingremoval of bedding and placement inlaundry hamper or designated area andreplacing with clean sheets and beddingprovided by the member 8. Ensure walkways are clear of trippinghazards9. Vacuum/sweep all finished living space floors (not includingfurniture) 10. Clean exterior and interior of toilets 11. Dust and wet wipe all flat surfaces within reach that do notrequire a ladder or moving furniture 12. Scrub and dry sinks, showers, and fixtures 13. Clean outside surface of kitchen and bathroom cabinets 14. Dust Mantle/shelves/tabletops/electronics/dressers/headboardsin all rooms of finished living space 15. Clean mirrors, glass in picture frames and other glass surfaces,excluding windows 16. Laundry - 2 load max,including washing, drying, folding and putting away in closets, furniture or designated area at members directio",947,131,175.00,,Cancelled,,,0.00,0.00,2025-05-12,[],0.00,0.00,2,1,1 - 999 Sq Ft,,
,,06/08/2025,08:00 AM,2025-06-08T08:00:00-07:00,2025-06-08T12:00:00-07:00,Suchitra,Chari,Suchitra Chari,,false,suchitra_pt@yahoo.com,,"1238 Gusty Loop, Livermore, CA, USA",Livermore,California,="94550",6509182025,0,,238.33,0.00,202.58,175.00,0.00,0.00,175.00,0.00,0.00,0.00,0.00,Cash/Check,,Biweekly Home Cleaning Service,recurring,,0.00,0.00,35.75,0.00,0,,Unassigned,Unassigned,0.00,,,2025-03-25,Prateek Gupta,04:00,Home Cleaning,Form 1,Test Location,0,Service Area,Regular Cleaning,$350 for 2 cleanings per month,,Light dusting of the backyard patio + garage if the time allows.,"Light sweeping &amp; removing visible cowebs in the garage, &amp; dusting of the back patio and watering the front door floor cemented patch.","end no more than 15 mins on sweeping &amp; removing visible cowebs in the garage, &amp; 15 mins on the back patio and watering the front door floor cemented patch.",1059,36,175.00,$350 for 2 cleanings per month,Cancelled,,,0.00,0.00,2025-06-05,[],0.00,0.00,3,2.5,1000 - 1499 Sq Ft,,
,,06/10/2025,12:00 PM,2025-06-10T12:00:00-07:00,2025-06-10T15:00:00-07:00,Jaya,Singhal,Jaya Singhal,,true,singhaljaya@gmail.com,,"2859 Feather Road, Manteca, CA, USA",Manteca,California,="95337",4088380687,0,,209.66,0.00,178.21,165.00,0.00,0.00,165.00,0.00,0.00,0.00,0.00,Cash/Check,,Biweekly Home Cleaning Service,recurring,,0.00,0.00,31.45,0.00,0,,Unassigned,Unassigned,0.00,,,2025-03-25,Prateek Gupta,03:00,Home Cleaning,Form 1,Test Location,0,Service Area,Regular Cleaning,,,,regular cleaning of 1 bedroom 2 full-bathrooms kitchen living room,"regular cleaning of 1 bedroom, 2 full-bathrooms, kitchen, living room",1246,9,165.00,,Cancelled,,,0.00,0.00,2025-05-27,[],0.00,0.00,1,2,1 - 999 Sq Ft,,
,,06/11/2025,09:00 AM,2025-06-11T09:00:00-07:00,2025-06-11T12:00:00-07:00,Mahendra,Patel,Mahendra Patel,596 (without Copay) - Helper Bees,false,mmnpatel48@gmail.com,,"3580 Martigues Ct, San Jose, CA, USA",San Jose,California,="95148",4084999165,0,,195.83,0.00,176.25,175.00,0.00,0.00,175.00,0.00,0.00,0.00,0.00,Cash/Check,,Monthly Home Cleaning Service,recurring,,0.00,0.00,19.58,0.00,0,"[
  {
    Email Id: nydialarson2023@gmail.com,
    Id: 107,
    Name: Nydia Larson - San Jose,
    Payment Amount: 0.00,
    Phone Number: 5108535076
  }
